CD_TYPO;CD_TABLE;LB_NOM_TYPO;NOM_JEU_DONNEES;DATE_CREATION;AUTEUR_TYPO;AUTEUR_TABLE;TERRITOIRE;ORGANISME;LANGUE;PRESENTATION;DESCRIPTION;ORIGINE;REF_BIBLIO;MOTS_CLES;REFERENCEMENT;DIFFUSION;DERNIERE_MODIF;TYPE_TABLE;CD_TYPO_ENTRE;CD_TYPO_SORTIE
78;TYPO_HABITATS_NAT_REUNION;Habitats_naturels_et_semi-naturels_de_La_Réunion_(2021);Typologie descriptive des habitats naturels et semi-naturels de La Réunion (2021);24/08/2016;Marie Lacoste, Pauline Delbosc, Frédéric Picot (Conservatoire botanique national de Mascarin);Rémy Poncet & V. Gaudillat (PatriNat);La Réunion;Conservatoire botanique national de Mascarin;FR;Ce référentiel typologique réalisé par le Conservatoire botanique de Mascarin est une évolution du référentiel proposé par Strasberg et coll. (2000). Les auteurs listent 434 postes typologiques. Chaque habitat élémentaire fait l’objet d’une note descriptive contenant un diagnostic écologique, structural, floristique, la liste des espèces compagnes (le cas échéant), la correspondance avec le code Corine biotopes Réunion (Strasberg et al., 2000, rév. 2010) et la localisation géographique d’un type caractéristique.;Mise au format HabRef de la table transmise par le Conservatoire botanique national de Mascarin.;"Fichier excel (""TYPO_HABITATS_REUNION_TDHR20210906"") transmis par M. Lacoste le 02/02/2022.";Lacoste M., Delbosc P. & Picot F., 2021. Typologie descriptive des habitats naturels et semi-naturels de La Réunion 2009-2021, version août 2021. Conservatoire botanique national de Mascarin, Saint-Leu, 165 p.;Classification, DOM, La Réunion, habitat, typologie;PatriNat, 2023. Table de la typologie descriptive des habitats naturels et semi-naturels de La Réunion 2009-2021, version août 2021. Base de données HabRef v7.;true;"HABREF v7 : mise à jour des habitats de l'étage mésotherme (suppression des habitats listés dans la version 6 d'HABREF et remplacement par les habitats listés dans la version 2021 de la typologie) ; ajout de 3 habitats d'autres étages (3.1.1.5, 3.1.1.6, 4.1.1.15) ; suppression d'espaces blancs résiduels se situant après les codes (champ ""LB_CODE"") de 4 habitats (5.1.3.3, 5.3.1.1, 5.3.1.2, 5.3.1.3).
HABREF v6 : mise en table des relations habitats-espèces (diagnostiques et compagnes).";TYPO;;
91;TYPO_MARSTALLER;Classification_bryosociologique_européenne_(2006);Syntaxonomischer Konspekt der Moosgesellschaften Europas und angrenzender Gebiete;18/03/2019;Rolf Marstaller;Vincent Gaudillat (UMS PatriNat) & Emilie Vallez;Europe et régions voisines.;-;DE;"La classification phytosociologique range les groupements végétaux dans un système hiérarchique à plusieurs niveaux (de la classe à la sous-association) qualifié de synsystème phytosociologique. Le conspectus de Marstaller (2006) présente un synsystème des communautés bryophytiques pour l'Europe et les régions avoisinantes. Il comporte 13 classes, 25 ordres, 64 alliances, 11 sous-alliances et 348 associations.
A chaque unité a été attribué un code constitué d'une succession de un à quatre numéros séparés par un point. Le premier numéro est celui de la classe, le deuxième de l'ordre dans la classe, le troisième de l'alliance dans l'ordre, le quatrième de l'association dans l'alliance (ou la sous-alliance éventuellement). Les 7 associations qui n'ont pas pu être positionnées dans le synsystème sont codées de 14.0.0.1 à 14.0.0.7.
Le conspectus indique pour chaque unité la synonymie, le type, une diagnose, la combinaison d'espèces caractéristique et la chorologie.";"Mise en table des syntaxons retenus dans le conspectus bryosociologique de Marstaller (2006), à l'exclusion des sous-associations. Seuls les intitulés des syntaxons ont été saisis, les autres informations n'ont pas été reprises.
Dans le conspectus, le code 9.1.1.4 est absent (les unités passent directement du code 9.1.1.3 au 9.1.1.5) et le code 10.2.2.1 est utilisé pour deux syntaxons (Scapanio gracilis-Dicranetum scottiani Zippel 1998 et Echinodietum prolixi v. Hübschm. 1971).
Dans la version 5 d'HABREF, la sélection des unités présentes en France n'avait pas été effectuée. A défaut, la répartition de toutes les unités de la typologie avait été artificiellement renseignée avec le statut ""A confirmer"". Dans la version 6, ce statut de présence en France a été précisé. Les syntaxons du conspectus qui se retrouvent dans le synopsis bryosociologique de la France (Bardat & Hauguel, 2002) ont été indiqués comme présents en France. Ce travail a été réalisé par comparaison sur Excel entre les noms des unités des deux typologies puis vérifié manuellement par l'UMS PatriNat. Ceci constitue un premier tri qui méritera d'être complété.";Scan de l'article de Marstaller 2006 sous la forme d'un fichier pdf puis utilisation de la fonction reconnaissance de caractère d'Adobe® Acrobat® (OCR) pour transférer le texte en base de données. Quelques erreurs peuvent subsister par rapport à l'article initial du fait d'une mauvaise reconnaissance de caractères par Adobe® Acrobat®.;Marstaller R., 2006. Syntaxonomischer Konspekt der Moosgesellschaften Europas und angrenzender Gebiete. Haussknechtia, 13 : 1-192.;Bryosociologie, classification, phytosociologie, synopsis, Europe.;Marstaller R., 2006. Syntaxonomischer Konspekt der Moosgesellschaften Europas und angrenzender Gebiete. Haussknechtia, 13 : 1-192. Mise en table : UMS PatriNat / INPN, juillet 2021.;true;"HABREF v6 : le statut de présence en France des unités a été précisé (cf. explications plus haut).
HABREF v7 : le statut de plusieurs unités a été modifié de ""Absent"" en ""Présent"" en France métropolitaine (Rhynchostegielletum jacquinii, Cinclidoto fontinaloidis-Dialytrichietum mucronatae, Hyophiletum involutae, Fissidenti rivularis-Rhynchostegielletum jacquinii, Cephaloziello baumgartneri-Southbyion nigrellae).";TYPO;;
106;TYPO_CRSP_HAB_REU_CB_REU;HAB_REU_CB_REU;Correspondances entre la typologie des habitats naturels de La Réunion et la typologie CORINE biotopes de La Réunion;19/10/2021;Marie Lacoste, Pauline Delbosc, Frédéric Picot (Conservatoire botanique national de Mascarin);Emilie Vallez & Vincent Gaudillat (UMS PatriNat, OFB-CNRS-MNHN);La Réunion;Conservatoire botanique national de Mascarin;FR;Dans la typologie descriptive des habitats naturels et semi-naturels de La Réunion (2017), des correspondances sont proposées avec la typologie des habitats CORINE biotopes de La Réunion (Strasberg et coll., 2000, rév. 2010) dont elle constitue une évolution.;Mise en table des correspondances selon les standards d'HABREF. Plusieurs correspondances pointant vers des habitats absents de la typologie des habitats CORINE biotopes de La Réunion n'ont pas pu être reprises.;Fichier excel transféré en mai 2017 par le conservatoire botanique national de Mascarin.;Lacoste M., Delbosc P. & Picot F., 2017 - Typologie descriptive des habitats naturels et semi-naturels de La Réunion, version Janvier 2017. Conservatoire botanique de Mascarin, Saint-Leu, 137 p.;Classification, DOM, La Réunion, typologies, correspondances, CORINE biotopes.;Lacoste M., Delbosc P. & Picot F., 2017 - Correspondances entre la typologie descriptive des habitats naturels et semi-naturels de La Réunion, version Janvier 2017 et la typologie des habitats CORINE biotopes de La Réunion (2000, rév. 2010). Conservatoire botanique de Mascarin, Saint-Leu. Mise en table : UMS PatriNat (OFB-CNRS-MNHN) / INPN, octobre 2021.;true;;CRSP;78;72
79;TYPO_FORETS_GUYANE;Habitats_forestiers_de_Guyane;Catalogue des habitats forestiers de Guyane (Guitet et al., 2015);14/11/2016;Stéphane Guitet (Institut national de la recherche agronomique - Office national des forêts), Olivier Brunaux (Office national des forêts), Jean-Jacques de Granville, Sophie Gonzales (Institut de recherche pour le développement), Cécile Richard-Hansen (Office national de la chasse et de la faune sauvage);Rémy Poncet (UMS PatriNat, AFB-CNRS-MNHN);Guyane;Office national des forêts;FR;Le catalogue des habitats forestiers de Guyane résulte d’un travail collaboratif mené entre des instituts de recherche (UMR EcoFoG, Amap, Geode, IRD, INRA, CIRAD) et des organismes de gestion et de conservation des milieux naturels de Guyane (ONF, ONCFS, Parc Amazonien de Guyane) débuté en 2006 avec le programme « Paysage et biodiversité en forêt guyanaise » (2006-2010) et poursuivi avec le programme « Habitats » (2010-2012). Les auteurs font évoluer la typologie de 2001 (Hoff) concernant les habitats forestiers pour lesquels ils proposent une nouvelle classification comprenant 41 types imbriqués hiérarchiquement dans trois niveaux : Habitats génériques > Habitats principaux > Habitats particuliers (par ex. : 41.2 Forêts de la plaine côtière > 41.22 Forêts côtières des terres hautes > 41.22r Forêts littorales sur rochers). Ces habitats font l'objet de fiches descriptives, à l'exception des types 41.11f (Marécage boisé à palmiers-bâches) et 41.11m (Forêt marécageuse à moutouchi).;"Mise en table de la publication ""Catalogue des habitats forestiers de Guyane"". Les habitats particuliers 41.--c (Forêts sur cuirasse), 41.--i (Forêts sur inselberg et savane-roche), 41.--q (Forêts sur quartzites) et 41.--s (Forêts sur saprolite superficielle) peuvent concerner tout ou partie de plusieurs habitats principaux : 41.4 à 41.6. Dans la table de données, ils ont été regroupés dans une unité baptisée ""Habitats particuliers transversaux"", mais leur déclinaison pour chaque habitat principal concerné a également été individualisée. Par exemple, pour l'habitat particulier 41.--c, 8 postes typologiques ont été créés : 41.41c, 41.42c, 41.43c, 41.44c, 41.51c, 41.52c, 41.53c, 41.61c. Le descriptif de ces 4 habitats particuliers (41.--c, etc.) est générique et n'a pas été adapté aux habitats principaux concernés. De ce fait, dans les postes typologiques créés apparaissent à la fois les informations liées à l'habitat principal et de l'habitat particulier. Par exemple, le descriptif de l'habitat 41.41c reprend celui de l'habitat principal 41.41 et de l'habitat particulier 41.--c.";Fichier créé par Rémy Poncet (UMS PatriNat).;"Guitet S., Brunaux O., de Granville J.-J., Gonzalez S. & Richard-Hansen C., 2015. Catalogue des habitats forestiers de Guyane. DEAL Guyane, 120 p.
Hoff M., 2001. Liste des habitats naturels de Guyane. http://herbier.unistra.fr/flore-et-vegetation-doutre-mer/flore-et-vegetation-de-guyane/code-corine-biotopes-de-guyane-francaise/";Classification, végétations, DOM, Guyane, habitat, typologie;Guitet S., Brunaux O., de Granville J.-J., Gonzalez S. & Richard-Hansen C., 2015. Catalogue des habitats forestiers de Guyane. DEAL Guyane, 120 p. Mise en table : UMS PatriNat / INPN, janvier 2017.;true;;TYPO;;
95;TYPO_SPM_MER;Habitats_marins_de_Saint-Pierre-et-Miquelon;Typologie des habitats marins de Saint-Pierre-et-Miquelon;18/04/2019;Noëmie Michez (UMS PatriNat, AFB-CNRS-MNHN).;Vincent Gaudillat (UMS PatriNat, AFB-CNRS-MNHN).;Saint-Pierre-et-Miquelon.;UMS PatriNat (AFB-CNRS-MNHN).;FR;Typologie créée dans le cadre de la constitution des listes d'habitats éligibles au dispositif d'arrêté préfectoraux de protection des habitats naturels (APHN). Référentiel à compléter.;Création d'une typologie ex-nihilo en lien avec les experts et acteurs locaux.;Table créée par Vincent Gaudillat (UMS PatriNat).;;Typologie, habitats, marins, Saint-Pierre-et-Miquelon.;Michez N., 2019. Typologie des habitats marins de Saint-Pierre-et-Miquelon. UMS PatriNat (AFB-CNRS-MNHN), Paris.;true;;TYPO;;
97;TYPO_VEGETATION_CLIPPERTON;Groupements_végétaux_de_Clipperton;Typologie des groupements végétaux de Clipperton (Sachet, 1962);03/07/2019;Marie-Hélène Sachet;Emilie Vallez & Rémy Poncet (UMS PatriNat (AFB - CNRS - MNHN));Clipperton;Pacific Science Board;Anglais;"Dans le cadre de l'année géophysique internationale de 1958, la ""Scripps Institution of Oceanography"" a conduit une expédition visant à inventorier la biodiversité de l'atoll de Clipperton. Marie-Hélène Sachet, rattachée au Pacific Science Board a ainsi pu réaliser un inventaire de la flore de ce territoire et proposer une première description de ses groupements végétaux.";"Extraction des informations contenues dans la publication ""Flora and vegetation of Clipperton Island"" (Sachet, 1962). Structuration de la classification (modifications par rapport au document d'origine) et mise en table des informations. Traduction en français (langue d'origine : anglais).";Fichier créé par Emilie Vallez et Rémy Poncet (UMS PatriNat (AFB - CNRS - MNHN));Sachet M.‐H., 1962. Flora and vegetation of Clipperton Island. Proceedings of the California Academy of  Sciences, Fourth Series 10: 249‐307. ;Classification, végétations, typologie, Clipperton, Océan Pacifique, atoll;Sachet M.‐H., 1962. Flora and vegetation of Clipperton Island. Proceedings of the California Academy of  Sciences, Fourth Series 10: 249‐307. Mise en table : UMS PatriNat / INPN, juillet 2019.;true;;TYPO;;
124;CRSP_ATL_EUNIS2022;ATL_EUNIS2022;Correspondances entre la typologie nationale des habitats marins benthiques de la Manche, de la Mer du Nord et de l'Atlantique  (NatHab-Atl) et la classification des habitats EUNIS (2022) ;17/02/2023;PatriNat;PatriNat;côtes françaises d'Atlantique, Manche, Mer du Nord ;PatriNat;FR;La typologie NatHab-Atl est la typologie nationale de référence pouvant être utilisée pour l’ensemble des programmes et outils qui concernent la façade Atlantique, Manche ou Mer du Nord. Les correspondances entre cette liste de référence et les principales typologies existantes dont la classification des habitats EUNIS 2022 ont été établies.;"Mise en table des correspondances entre la classification des habitats EUNIS (2022) et les habitats marins benthiques de la Manche, de la Mer du Nord et de l'Atlantique (NatHab-Atl). La relation de correspondance entre les deux habitats est précisée selon la méthode présentée dans le rapport Michez et al. (2012).
Les correspondances ont été effectuées uniquement pour les codes des unités EUNIS commençant par M (Marine benthic habitats) et présentes en France, pour les niveaux 4, 5 et 6.";Fichier créé par Salomé Andres et Marie La Rivière (PatriNat);"Michez N., Thiébaut E., Dubois S., Le Gall L., Dauvin J.C., Andersen A. C., Baffreau A., Bajjouk T., Blanchet H., de Bettignies T., de Casamajor M.-N., Derrien-Courtel S., Houbin C., Janson A.L., La Rivière M., Lévèque L., Menot L., Sauriau P.G., Simon N., Viard F., 2019. Typologie des habitats marins benthiques de la Manche, de la Mer du Nord et de l’Atlantique. Version 3. UMS PatriNat, Muséum national d'Histoire naturelle, Paris, 52 p.

La Rivière M., Delavenne J., Janson A.-L., Andres S., de Bettignies T., Blanchet H., Decaris F.-X., Derrien R., Derrien-Courtel S., Grall J., Houbin C., Latry L., Le Gal A., Lutrand A., Menot L., Percevault L., Tauran A., Thiébaut E., 2022. Fiches descriptives des habitats marins benthiques de la Manche, de la Mer du Nord et de l'Atlantique. PatriNat (OFB-CNRS-MNHN), Paris.

European Topic Centre on Biological Diversity 2022. EUNIS marine habitat classification 2022 including crosswalks. Table Excel. ";correspondances, habitat marin, typologie, habitat benthique, EUNIS, Atlantique, Manche, Mer du Nord, France, NatHab;PatriNat, 2023. Table de correspondances entre la typologie nationale des habitats marins benthiques de la Manche, de la Mer du Nord et de l'Atlantique (NatHab-Atl) et la classification EUNIS 2022. Base de données HabRef v7.;true;;CRSP;46;107
93;TYPO_EPARSES_MER;Habitats_marins_des_îles_Éparses;Typologie des habitats marins des îles Éparses;17/04/2019;Noëmie Michez (UMS PatriNat - AFB-CNRS-MNHN), en collaboration avec Sophie Marinesque et Alexis Cuvillier (TAAF);Vincent Gaudillat (UMS PatriNat - AFB-CNRS-MNHN);Iles Éparses;UMS PatriNat (AFB-CNRS-MNHN);FR;Typologie créée dans le cadre de la constitution des listes d'habitats éligibles au dispositif des arrêtés préfectoraux de protection des habitats naturels (APHN).;Création d'une typologie ex-nihilo en lien avec les experts et acteurs locaux. Il s'agit d'une première synthèse des connaissances qui a vocation à être affinée.;Table créée par Vincent Gaudillat (UMS PatriNat).;;Typologie, habitat, îles, Éparses.;Michez N., 2018. Typologie des habitats marins des îles Éparses. UMS PatriNat (AFB-CNRS-MNHN), Paris.;true;;TYPO;;
99;TYPO_VEGETATION_WALLIS_ET_FUTUNA_ET_NOUVELLE_CALEDONIE;Végétations_de_Wallis_et_Futuna_et_de_Nouvelle_Calédonie;"Typologie préliminaire des végétations de Wallis et Futuna et de Nouvelle-Calédonie (Hoff et al., 1983 ; Hoff & Brisse, 1990 ; Hoff, 1993)";20/08/2019;Michel Hoff, Henry Brisse et Gilles Grandjouan (1983) et Michel Hoff et Henry Brisse (1990) et Michel Hoff (1993);Emilie Vallez & Rémy Poncet (UMS PatriNat (AFB - CNRS - MNHN));Wallis-et-Futuna, Nouvelle Calédonie;ORSTOM;Français;"Les auteurs ont étudié les groupements végétaux rudéraux et anthropiques de Nouvelle Calédonie (Hoff et al., 1983) et décrivent pour ce territoire 27 associations réparties en quatre classes : une concernant les prairies et savanes subissant des feux périodiques, une qui caractérise les végétations culturales et post-culturales, une associée aux cultures pluriannuelles (vergers, jardins, etc.) et une qui regroupe les végétations de pierriers, décombres et bords de rivières plus ou moins nitrophiles.
Dans une deuxième publication (Hoff & Brisse, 1990), les auteurs décrivent les principaux groupements végétaux de Wallis-et-Futuna, à l'exception des forêts de moyenne altitude. Ils portent une attention particulière aux groupements rudéraux et anthropiques.
Dans une troisième publication (Hoff, 1993), l'auteur propose un synsystème préliminaire commun à Wallus-et-Futuna et à la Nouvelle Calédonie.";"Extraction des informations contenues dans les trois publications ""La végétation rudérale et anthropique de la Nouvelle Caledonie et des Iles Loyaute (Pacifique Sud)"" (Hoff et al., 1983) et ""Contribution à l'étude des groupements végétaux des îles Wallis et Futuna"" (Hoff & Brisse, 1990) et ""Liste préliminaire des unités syntaxonomiques de Guyane française, de Nouvelle-Calédonie, de Wallis et Futuna"" (Hoff, 1993). Structuration de la classification (modifications par rapport aux documents d'origine : uniformisation des trois typologies, etc.) et mise en table des informations.";Fichier créé par Emilie Vallez et Rémy Poncet (UMS PatriNat (AFB - CNRS - MNHN));"Hoff M., Brisse H & Grandjouan G., 1983. La végétation rudérale et anthropique de la Nouvelle Calédonie et des Iles Loyauté (Pacifique Sud). Colloques phytosociologiques, XII, 179-248.
Hoff M. & Brisse H., 1990. Contribution à l'étude des groupements végétaux des îles Wallis et Futuna. Documents phytosociologiques, XII, 19-76.
Hoff M., 1993. Liste préliminaire des unités syntaxonomiques de Guyane française, de Nouvelle-Calédonie, de Wallis et Futuna. Colloques phytosociologiques, XXII, 663-688.";Classification, végétations, typologie, Nouvelle Calédonie, Wallis-et-Futuna, Océan Pacifique;Hoff M., Brisse H & Grandjouan G., 1983. La végétation rudérale et anthropique de la Nouvelle Calédonie et des Iles Loyauté (Pacifique Sud). Colloques phytosociologiques, XII, 179-248. ET Hoff M. & Brisse H., 1990. Contribution à l'étude des groupements végétaux des îles Wallis et Futuna. Documents phytosociologiques, XII, 19-76. ET Hoff M., 1993. Liste préliminaire des unités syntaxonomiques de Guyane française, de Nouvelle-Calédonie, de Wallis et Futuna. Colloques phytosociologiques, XXII, 663-688. Mise en table : UMS PatriNat / INPN, juillet 2019.;true;;TYPO;;
96;TYPO_GUYANE_MER;Habitats_marins_de_Guyane;Typologie des habitats marins de Guyane;07/06/2019;Noëmie Michez (UMS PatriNat, AFB-CNRS-MNHN) & Amandine Bordin (GEPOG/RNN de l'île du Grand-Connétable).;Vincent Gaudillat (UMS PatriNat, AFB-CNRS-MNHN).;Guyane;UMS PatriNat (AFB-CNRS-MNHN).;FR;Typologie créée dans le cadre de la constitution des listes d'habitats éligibles au dispositif des arrêtés préfectoraux de protection des habitats naturels (APHN).;Création d'une typologie ex-nihilo en lien avec les experts et acteurs locaux. Il s'agit d'une première synthèse des connaissances qui a vocation à être affinée.;Table créée par Vincent Gaudillat (UMS PatriNat).;;Typologie, habitats, marins, Guyane.;Michez N. & Bordin A., 2018. Typologie des habitats marins de Guyane. UMS PatriNat (AFB-CNRS-MNHN), GEPOG/RNN de l'île du Grand-Connétable.;true;;TYPO;;
