CD_TYPO;CD_TABLE;LB_NOM_TYPO;NOM_JEU_DONNEES;DATE_CREATION;AUTEUR_TYPO;AUTEUR_TABLE;TERRITOIRE;ORGANISME;LANGUE;PRESENTATION;DESCRIPTION;ORIGINE;REF_BIBLIO;MOTS_CLES;REFERENCEMENT;DIFFUSION;DERNIERE_MODIF;TYPE_TABLE;CD_TYPO_ENTRE;CD_TYPO_SORTIE
70;TYPO_HABITATS_ANTILLES;Habitats_des_Antilles;Classification des habitats des Antilles;19/11/2009;Michel Hoff (coord.) (Service du patrimoine naturel - Muséum national d'Histoire naturelle, SPN-MNHN), avec la collaboration de E. Etifier-Chalano, J.-P. Fiard, B. de Foucault, P. Joseph;Horace Da Costa et Vincent Gaudillat (UMS PatriNat);Antilles françaises;UMS PatriNat (AFB-CNRS-MNHN), anciennement SPN;FR;"Une ""Typologie provisoire des habitats naturels des départements d'outre-mer français"" a été publiée en 1997 (Hoff, coord). Pour sa conception, l'auteur s'est appuyé sur CORINE biotopes (Devillers et al., 1991) et la classification des habitats du Paléarctique (Devilliers & Devilliers-Terschuren, 1996) en les adaptant légèrement (modifications de certains intitulés ; plus rarement, pour un même code, changement du type d'habitat). Pour les habitats des départements d'outre-mer ne correspondant à aucun habitat de ces deux classifications, de nouveaux codes ont été créés en suivant le même système hiérarchique.
Cette classification des habitats des Antilles françaises en est un extrait et comporte 523 habitats répartis en 7 grandes familles de milieux : A1 Habitats littoraux et halophiles ; A2 Habitats aquatiques non marins ; A3 Landes, fruticées, fourrés, pelouses, prairies et savanes ; A4 Forêts ; A5 Tourbières et marais ; A6 Rochers continentaux, éboulis et sables intérieurs ; A8 Terrains agricoles et paysages artificiels.";"Mise en table de la ""Typologie provisoire des habitats naturels des départements d'outre-mer français"" (Hoff, 1997) pour les habitats présents dans les Antilles françaises.
La table Habitats chargée sur le logiciel Znieff (1re version), fondée sur cette typologie, a été utilisée comme support de départ ; elle ne concernait cependant que les habitats des niveaux 1 à 4. Les habitats manquants ont été ajoutés à la table à partir de la version word de la typologie. Lors de ce travail, des corrections orthographiques ou typographiques ont été apportées, quelques codes habitats erronés ont également été corrigés (27.17 en 24.17, 34.221 en 24.221, 52.821 en 53.821, 62.53 en 65.53, 62.51 en 62.52), et le préfixe ""A"" a été ajouté à tous les codes des habitats de la table. La typologie de Hoff (1997) ne précise pas la répartition des habitats dans les différents territoires des Antilles.
À défaut d'informations complémentaires, tous ces habitats ont tous été provisoirement mentionnés présents en Guadeloupe, Martinique et à Saint-Barthélemy et Saint-Martin.";"Table Habitats chargée sur le logiciel Znieff (1re version) en octobre 2009 et version word (""HABDOM.DOC"") de la typologie Hoff de 1997, transmise par son auteur le 16/10/2009.";"Hoff M. (coord.), 1997. Typologie provisoire des habitats naturels des départements d'outre-mer français, basée sur CORINE biotopes et la ""Classification of Palaearctic habitats"" du Conseil de l'Europe. SPN-IEGB-MNHN, Paris, 40 p. Devillers P., Devillers-Terschuren J., Ledant J.-P. & coll., 1991. CORINE biotopes manual. Habitats of the European Community. Data specifications - Part 2. EUR 12587/3 EN. European Commission, Luxembourg, 300 p. Devilliers P. & Devilliers-Terschuren J., 1996. A classification of Palaearctic habitats. Nature and environment, No. 78, Council of Europe, Strasbourg, 194 p.";Classification, habitats, DOM, Antilles, Corine Biotopes, Paléarctique.;"Hoff M. (coord.), 1997. Classification des habitats des Antilles françaises. Extrait de la Typologie provisoire des habitats naturels des départements d'outre-mer français, basée sur CORINE biotopes et la ""Classification of Palaearctic habitats"" du Conseil de l'Europe. SPN-IEGB-MNHN, Paris, 40 p. Mise en table : UMS PatriNat / INPN, octobre 2019.";true;"Octobre 2019 : dans le cadre de la sélection des habitats APHN (2018-2019), des modifications mineures d'intitulés ont été réalisées pour une meilleure justesse typologique et une meilleure adéquation aux besoins, les CD_HAB n'ont pas été modifiés et assurent donc la correspondance avec les anciens intitulés.
D'autres modifications plus importantes ont aussi été faites :
1) les unités sous le poste ""A24 - Eaux courantes"" ont toutes été supprimées et remplacées par de nouvelles (nouveaux CD_HAB), la correspondance des unités anciennes vers les nouvelles a été assurée lorsqu'il a été possible de le faire pour les unités qui ont été utilisées dans le cadre des ZNIEFF ;
2) le poste ""A4A.3 - Forêts à Euterpe oleracea (Pinotières)"" a été déclaré mentionné par erreur ;
3) les unités ""A11.D - Fonds vaseux"" et ""A12.7 - Fonds à débris coralliens"" ont été créées.
L'ensemble de ces modifications a été fait en concertation avec les CSRPN.";TYPO;;
108;TYPO_MARTINIQUE_MER;Habitats_benthiques_de_la_Martinique;Typologie des habitats benthiques de la Martinique;11/03/2022;Salomé Andres (PatriNat), Romain Ferry (Association OCEANvironnement), Vincent Gaudillat (PatriNat), Guillaume Dirberg (UMR Borea);Salomé Andres (PatriNat);Martinique;PatriNat;FR;"Les territoires ultra-marins hébergent une très grande partie de la biodiversité française avec une riche diversité d'habitats et d'espèces. Malgré les forts enjeux de conservation qui en découlent, les connaissances sur ces territoires restent partielles et insuffisantes comparées à celles de la métropole, notamment au niveau des habitats marins. Dans l'optique de pallier ce manque de connaissance, une première typologie d'habitats marins a été élaborée en Martinique (Andres et al., 2022).
Ce travail a pu être engagé dans ce territoire grâce aux données collectées lors de l'expédition Madibenthos, réalisée en Martinique par le Muséum national d'Histoire naturelle (MNHN) en 2016 et à la liste d'habitats marins initiée par Dirberg et Ferry. Une typologie des département d'outre-mer (Guillaume et al., 1997) avait précédemment été élaborée dans le cadre du programme ZNIEFF et ciblait notamment la Martinique. Cependant, l’ancienneté des données à l’origine de cet inventaire (campagne Corantile II, 1983-1984), la vitesse de dégradation des habitats marins (accélérée ces dernières années) et les bouleversements causés par les fréquents cyclones en Martinique ne permettaient pas une simple mise à jour ce de précédent travail.
Cette typologie expose les habitats marins présents en Martinique au moment de son élaboration. Elle contient 246 unités typologiques au total, hiérarchisée en 5 niveaux : 1) l'étage, 2) le substrat, 3) la géomorphologie (pour les substrats durs)/le type de substrat meuble (pour les substrats meubles), 4) les peuplements dominants et 5) l'habitat.";Mise en table au format HabRef des données contenues dans la typologie des habitats marins de la Martinique.;Le jeu de données utilisé pour constituer la typologie provient de la base de données de l'expédition Madibenthos (MNHN, 2016) de G. Dirberg à laquelle s'ajoute des observations terrains réalisées par R. Ferry en 2020 et des connaissances d'experts mobilisés.;Andres S., Ferry R., Gaudillat V., Dirberg G., 2022. Typologie des habitats benthiques de la Martinique. Patrinat (OFB-CNRS-MNHN), Paris, 207 p.;Antilles, habitats marins, typologie, Martinique, référentiel;PatriNat, 2023. Table de la typologie des habitats benthique de la Martinique (Andres et al., 2022). Base de données HabRef v7.;true;;TYPO;;
71;TYPO_HABITATS_GUYANE;Habitats_de_la_Guyane;Classification des habitats de la Guyane;19/11/2009;Michel Hoff (coord.) (Service du patrimoine naturel - Muséum national d'Histoire naturelle, SPN-MNHN), avec la collaboration de E. Etifier-Chalano, J.-P. Fiard, B. de Foucault, P. Joseph;Horace Da Costa et Vincent Gaudillat (UMS PatriNat, AFB-CNRS-MNHN);Guyane;UMS PatriNat (AFB-CNRS-MNHN), anciennement SPN;FR;"Une ""Typologie provisoire des habitats naturels des départements d'outre-mer français"" a été publiée en 1997 (Hoff, coord). Pour sa conception, l'auteur s'est appuyé sur CORINE biotopes (Devillers et al., 1991) et la classification des habitats du Paléarctique (Devilliers & Devilliers-Terschuren, 1996) en les adaptant légèrement (modifications de certains intitulés ; plus rarement, pour un même code, changement du type d'habitat). Pour les habitats des départements d'outre-mer ne correspondant à aucun habitat de ces deux classifications, de nouveaux codes ont été créés en suivant le même système hiérarchique.

Cette classification des habitats de la Guyane française en est un extrait et comporte 544 habitats répartis en 7 grandes familles de milieux : G1 Habitats littoraux et halophiles ; G2 Habitats aquatiques non marins ; G3 Landes, fruticées, fourrés, pelouses, prairies et savanes ; G4 Forêts ; G5 Tourbières et marais ; G6 Rochers continentaux, éboulis et sables intérieurs ; G8 Terrains agricoles et paysages artificiels.";"Mise en table de la ""Typologie provisoire des habitats naturels des départements d'outre-mer français"" (Hoff, 1997) pour les habitats présents en Guyane française.

La table Habitats chargée sur le logiciel Znieff (1re version), fondée sur cette typologie, a été utilisée comme support de départ ; elle ne concernait cependant que les habitats des niveaux 1 à 4. Les habitats manquants ont été ajoutés à la table à partir de la version word de la typologie. Lors de ce travail, des corrections orthographiques ou typographiques ont été apportées, quelques codes habitats erronés ont été corrigés (58.32 en 57.32, 62.53 en 62.51, 86.431 en 86.451), et le préfixe ""G"" a été ajouté à tous les codes des habitats de la table. Un document intitulé ""Code CORINE biotopes Guyane"" (Hoff, non daté) est disponible sur internet. Il s'agit globalement d'un extrait de la typologie de 1997 limité à la Guyane, avec un certain nombre de différences, notamment l'ajout d'une centaine d'habitats. Quelques-uns de ces habitats (de niveau 1 à 4) figuraient dans la table Habitats du logiciel Znieff : 14, 14.1, 14.2, 46.56, 62.32, 87.19, 87.1A, 87.1B, 87.25. Ils ont été maintenus dans la présente classification, à l'exception des habitats 14, 14.1 et 14.2 qui posaient des problèmes de cohérence.";"Table Habitats chargée sur le logiciel Znieff (1re version) en octobre 2009 et version word (""HABDOM.DOC"") de la typologie Hoff de 1997, transmise par son auteur le 16/10/2009.";"Hoff M. (coord.), 1997. Typologie provisoire des habitats naturels des départements d'outre-mer français, basée sur CORINE biotopes et la ""Classification of Palaearctic habitats"" du Conseil de l'Europe. SPN-IEGB-MNHN, Paris, 40 p.
Hoff M., non daté. Code CORINE biotopes Guyane. Herbiers de l'Université de Strasbourg, Institut de Botanique, Strasbourg. Disponible sur http://herbier.unistra.fr/flores/flore-et-vegetation-de-guyane/code-corine-biotopes-de-guyane-francaise/ (consulté le 01/04/2014).";Classification, habitats, DOM, Guyane, Corine Biotopes, Paléarctique.;"Hoff M. (coord.), 1997. Classification des habitats de la Guyane. Extrait de la Typologie provisoire des habitats naturels des départements d'outre-mer français, basée sur CORINE biotopes et la ""Classification of Palaearctic habitats"" du Conseil de l'Europe. SPN-IEGB-MNHN, Paris, 40 p. Mise en table : UMS PatriNat / INPN, octobre 2019.";true;"Oct. 2019 : dans le cadre de la sélection des habitats APHN (2018-2019), des modifications d'intitulés ont été réalisées pour une meilleure justesse typologique et une meilleure adéquation aux besoins, les CD_HAB n'ont pas été modifiés et assurent donc la correspondance avec les anciens intitulés.
D'autres modifications plus importantes ont aussi été faites :
1) les postes ""G11.2"" ; ""G3C"" ; ""G3D"" ont été déclarés mentionnés par erreur. Les postes ""G61.9"" et  ""G66 (et unités inférieures)"" ont été supprimés.
2) les unités ""G11.D - Estuaires et embouchures"", ""G19.1 - Zone intertidale des îles et îlots rocheux"" et ""G19.2 - Partie émergée des battures"" ont été créées.
L'ensemble de ces modifications a été fait en concertation avec le CSRPN.";TYPO;;
73;CRSP_HIC_MED;HIC_MED;Correspondances entre la liste des habitats d'intérêt communautaire (HIC) de la DHFF et la typologie nationale des biocénoses benthiques de Méditerranée (NatHab-Med);01/04/2014;"Pour la typologie NatHab-Med : Noëmie MICHEZ (SPN, MNHN), Guillaume DIRBERG (SPN, MNHN), Annabelle AISH (SPN, MNHN), Gérard BELLAN (IMBE, Université Aix-Marseille, CNRS UMR 7263), Denise BELLAN-SANTINI (IMBE, Université Aix-Marseille, CNRS UMR 7263), Pierre CHEVALDONNE (IMBE, Université Aix-Marseille, CNRS UMR 7263), Marie-Claire FABRI (IFREMER, LER), Maïa FOURT (GIS Posidonie), Patrice FRANCOUR (Université de Nice-Sophia Antipolis, EA 4228 ECOMERS), Adrien GOUJARD (GIS Posidonie), Jean-Georges HARMELIN (MIO, Université Aix-Marseille, CNRS UMR 7294), Céline LABRUNE (Observatoire Océanologique de Banyuls sur Mer, FRE 3350 LECOB), Gérard PERGENT (Université de Corse Pasquale Paoli, UMR 6134 SPE), Christine PERGENT-MARTINI (Université de Corse Pasquale Paoli, UMR 6134 SPE), Stéphane SARTORETTO (IFREMER, LER), Jean VACELET (IMBE, Université Aix-Marseille, CNRS UMR 7263), Marc VERLAQUE (MIO, Université Aix-Marseille, CNRS UMR 7294)

Pour la liste des habitats d'intérêt communautaire de la DHFF : Commission européenne.

Pour les correspondances suite à l'interprétation nationale des HIC marins : La Rivière M., de Bettignies T., Delavenne J., Janson A.-L., Gaudillat V. (PatriNat)";PatriNat;Méditerranée française;PatriNat;FR;La typologie NatHab-Med est la typologie nationale de référence pouvant être utilisée pour l’ensemble des programmes et outils qui concernent la façade méditerranéenne. Les correspondances entre cette liste de référence et les habitats d'intérêt communautaire de la DHFF ont été établies en fonction de l'interprétation française des HIC marins.;"Mise en table des correspondances entre les biocénoses benthiques de Méditerranée NatHab-Med et la liste des HIC. La relation de correspondance entre les deux habitats est précisée selon la méthode présentée dans le rapport Michez et al. (2012) et selon l'interprétation française des HIC marins (de Bettignies et al., 2021 ; La Rivière et al., 2023)";Fichier créé par Noëmie MICHEZ et mis à jour par Marie LA RIVIERE;"Annexe I de la directive 92/43/CEE du Conseil du 21 mai 1992 concernant la conservation des habitats naturels ainsi que de la faune et de la flore sauvages. European Commission, 2007. Interpretation manual of European Union habitats. EUR 27. European Commission, DG Environment, 142 p.

Michez N., Dirberg G., Bellan-Santini D., Verlaque M., Bellan G., Pergent G., Pergent-Martini C., Labrune C., Francour P., Sartoretto S., 2011. Typologie des biocénoses benthiques de Méditerranée, Liste de référence française et correspondances. Rapport SPN 2011 - 13, MNHN, Paris, 48 pages.

Michez N., Fourt M., Aish A., Bellan G., Bellan-Santini D., Chevaldonné P., Fabri M.-C., Goujard A., Harmelin J.-G., Labrune C., Pergent G., Sartoretto S., Vacelet J., Verlaque M., 2014. Typologie des biocénoses benthiques de Méditerranée Version 2. Rapport SPN 2014 - 33, MNHN, Paris, 26 p.

de Bettignies T., La Rivière M., Delavenne J., Dupré S., Gaudillat V., Janson A.-L., Lepareur F., Michez N., Paquignon G., Schmitt A., de Roton G. & Toison V. (2021) Interprétation française des Habitats d’Intérêt Communautaire marins. PatriNat (OFB-CNRS-MNHN), Paris, 58 pp.

La Rivière M., de Bettignies T., Delavenne J., Janson A.-L., Gaudillat V. (2023) Note d’accompagnement des tables de correspondances entre les Habitats d’Intérêt Communautaire (HIC) marins et les unités des autres typologies d’habitats benthiques marins. PatriNat (OFB-CNRS-MNHN), Paris : 9 pp.";correspondances, habitat marin, typologie, biocénose benthique, N2000, Méditerranée, France, DHFF, NatHab, HIC;PatriNat, 2023. Table de correspondances entre la liste des habitats d'intérêt communautaire (HIC) de la DHFF et la typologie nationale des biocénoses benthiques de Méditerranée (NatHab-Med). Base de données HabRef v7.;true;Depuis HABREF v6 (février 2021) : Modification suite à la publication de l'interprétation nationale des HIC marins;CRSP;8;32
117;TYPO_CRSP_EUNIS_2022_EVC;EUNIS_2022_EUROVEGCHECKLIST;Correspondances entre les habitats EUNIS 2022 et la classification phytosociologique européenne (2016);27/10/2022;European Topic Centre on Biological Diversity (ETC/BD) - European Environment Agency;PatriNat;Europe;European Topic Centre on Biological Diversity (ETC/BD) - European Environment Agency / European Vegetation Survey (EVS);UK;En parallèle de la réalisation de la typologie EUNIS 2022, des tables de correspondances ont été établies entre les habitats EUNIS de niveau 3 et les unités d'autres typologies, dont les alliances de la classification phytosociologique européenne (Eurovegchecklist, Mucina et al., 2016). Ces correspondances concernent uniquement les végétations phanérogamiques, ainsi que les herbiers à characées.;"Mise au format HabRef de la table envoyée par Alterra.

EUNIS 2022 étant partiel, les alliances des végétations aquatiques, amphibies, de tourbières, marais et roselières, ne figurent pas dans cette table de correspondances.";"Fichier ""EUNIS-EuroVegChecklist-crosswalk-2021-06-01.xlsx"" envoyé par S. Hennekens (Alterra) le 13/02/2022. Cet envoi ayant précédé la publication de ces correspondances sur le site EUNIS de l'AEE, quelques différences de détail peuvent exister.";"European Topic Centre on Biological Diversity, 2021. EUNIS terrestrial habitat classification 2021 including crosswalks. ETC/BD-EEA. Table Excel.
Mucina L., Bültmann H., Dierßen K., Theurillat J.-P., Raus Th., Čarni A., Šumberová K., Willner W., Dengler J., Gavilán García R., Chytrý M., Hájek M., Di Pietro R., Iakushenko D., Pallas J., Daniëls F.J.A., Bergmeier E., Santos Guerra A., Ermakov N., Valachovič M., Schaminée J.H.J., Lysenko T., Didukh Y.P., Pignatti S., Rodwell J.S., Capelo J., Weber H.E., Solomeshch A., Dimopoulos P., Aguiar C., Hennekens S.M. & Tichý L., 2016. Vegetation of Europe: hierarchical floristic classification system of vascular plant, bryophyte, lichen, and algal communities. Applied Vegetation Science, 19 (Suppl. 1) : 3-264.";EUNIS, habitats, syntaxons, correspondances.;PatriNat, 2023. Table de correspondances entre les habitats EUNIS 2022 et les alliances de la classification phytosociologique européenne (Mucina et al., 2016). Base de données HabRef v7.;true;;CRSP;107;100
77;TYPO_CRSP_CB_EUNIS_2012;CB_EUNIS_2012;Correspondances entre les habitats CORINE biotopes et les habitats EUNIS 2012;18/09/2015;Justine Louvel-Glaser & Vincent Gaudillat (MNHN-SPN);Justine Louvel-Glaser & Vincent Gaudillat (MNHN-SPN);France;MNHN-SPN;FR;Associer des tables de correspondances des habitats la classification CORINE Biotopes et des habitats de la classification EUNIS (2012) aux traductions d'EUNIS réalisées en 2013 et 2015 a été jugé nécessaire. Une première table avait été fournie en accompagnement de la traduction de 2013, mais cette table issue de la base de données du CTE/DB s'est avérée incomplète. Le SPN-MNHN a donc révisée ces correspondance en se concentrant uniquement sur les habitats présents en France.;Mise en table des correspondances entre les habitats de la classification CORINE Biotopes et les habitats de la classification EUNIS (2012) établies dans le rapport Correspondances entre les classifications d’habitats CORINE Biotopes et EUNIS (LOUVEL-GLASER J. & GAUDILLAT V., 2015). S'y reporter pour prendre connaissance du contexte, de la démarche et de leurs applications et limites. La relation de correspondance entre deux habitats est précisée.;Création de la table par Justine Louvel-Glaser, en s'appuyant sur les tables CLASSCOD de la base Access Luhab2008, HABEQUIV et HABITAT de la base Access Eunishab2008 du CTE/DB (Classcd 5 pour CB 1991 et Classcd 28 pour PAL 2001).;EUROPEAN TOPIC CENTRE ON BIOLOGICAL DIVERSITY, 2012. European Nature Information System (EUNIS) Database. Habitat types and Habitat classifications. ETC/BD-EEA, Paris. Traductions et statut de présence en France : SPN-MNHN & IFREMER, 2015. DEVILLERS P., DEVILLERS-TERSCHUREN J., LEDANT J.-P. & coll., 1991. CORINE biotopes manual. Habitats of the European Community. Data specifications - Part 2. EUR 12587/3 EN. European Commission, Luxembourg, 300 p. Traduction pour les types d'habitats présents en France : BISSARDON M. et GUIBAL L., 1997. Corine biotopes. Version originale. Types d'habitats français. ENGREF, Nancy, 217 p. Mise en table : SPN-MNHN / INPN, avril 2013. LOUVEL-GLASER J. & GAUDILLAT V., 2015. Correspondances entre les classifications d’habitats CORINE Biotopes et EUNIS. MNHN-DIREV-SPN, MEDDE, Paris, 119p.;Correspondances, typologie, CORINE Biotopes, EUNIS.;LOUVEL-GLASER J. & GAUDILLAT V., 2015. Table des correspondances entre les classifications d’habitats CORINE Biotopes et EUNIS 2012. SPN-MNHN.;true;;CRSP;22;7
