CD_TYPO;CD_TABLE;LB_NOM_TYPO;NOM_JEU_DONNEES;DATE_CREATION;AUTEUR_TYPO;AUTEUR_TABLE;TERRITOIRE;ORGANISME;LANGUE;PRESENTATION;DESCRIPTION;ORIGINE;REF_BIBLIO;MOTS_CLES;REFERENCEMENT;DIFFUSION;DERNIERE_MODIF;TYPE_TABLE;CD_TYPO_ENTRE;CD_TYPO_SORTIE
7;TYPO_EUNIS_2012;EUNIS_2012;Classification des habitats EUNIS 2012;08/04/2010;"European Topic Centre on Biological Diversity (ETC/BD) - European Environment Agency (pour la typologie)
PatriNat (OFB-CNRS-MNHN) et IFREMER (pour les traductions françaises et le statut de présence en France)";PatriNat (OFB-CNRS-MNHN);Domaine pan-européen;"European Topic Centre on Biological Diversity - European Environment Agency (pour la typologie)
PatriNat (OFB-CNRS-MNHN) et IFREMER (pour les traductions françaises et le statut de présence en France)";UK, FR;"La classification des habitats EUNIS est un système hiérarchisé de classification des habitats européens construit notamment à partir de la classification CORINE biotopes et de son successeur, la classification des habitats du Paléarctique. Par rapport à ces deux classifications, EUNIS se caractérise par une restructuration des 3-4 premiers niveaux d'habitats et un important développement de la partie consacrée aux habitats marins, sur la base du JNCC Marine Habitat Classification for Britain and Ireland et des typologies d'habitats développées dans le cadre des conventions marines de Barcelone et HELCOM. Les habitats terrestres de niveau plus fin sont généralement repris de la classification Paléarctique.

La classification EUNIS comporte 5282 habitats répartis en 10 grands types de milieux (A. Habitats marins, B. Habitats côtiers, C. Eaux de surface continentales, D. Tourbières hautes et bas-marais, E. Prairies ; terrains dominés par des herbacées non graminoïdes, des mousses ou des lichens, F. Landes, fourrés et toundras, G. Boisements, forêts et autres habitats boisés, H. Habitats continentaux sans végétation ou à végétation clairsemée, I. Habitats agricoles, horticoles et domestiques régulièrement ou récemment cultivés, J. Zones bâties, sites industriels et autres habitats artificiels), auxquels s'ajoute une classe particulière pour les mosaïques de milieux (X. Complexes d’habitats). Sur ce total, on estime que 2541 habitats sont présents ou à confirmer en France (état au 23/09/2019). Des traductions en français des intitulés et des descriptifs des habitats présents ou à confirmer en France ont été réalisées : cf. Louvel et al. (2013) pour les habitats terrestres et d'eau douce (version 2008 d'EUNIS) et Bajjouk et al. (2015) pour les habitats marins (version 2012 d'EUNIS).";"Table présentant les informations de base des habitats EUNIS (version 2012) : code, code parent, niveau, nom, descriptif (et note additionnelle éventuelle) et origine du descriptif. Les données sont extraites de la base ""Eunishab_2008.mdb"", sauf les descriptifs qui ont fait l'objet d'une mise à jour en 2012. Les noms de certains champs ont été modifiés pour assurer une homogénéité avec les autres bases habitats. En complément, ont été ajoutés :
- le statut de présence en France ;
- la traduction des libellés et descriptifs pour les habitats présents en France.

Le statut de présence en France est notamment issu de Louvel et al. (2013) et de Bajjouk et al. (2015), mais il est susceptible d'être affiné en fonction de l'évolution des connaissances et d'une utilisation plus courante de la classification EUNIS (des modifications ont déjà été apportées par rapport à ces deux documents).

La traduction en français des libellés et descriptifs des habitats de la section A, de quelques habitats des sections B et X (B, B1.223, B1.224, B2.1, B3.1, B3.11, B3.111, B3.112, B3.113, B3.1131, B3.1132, B3.114, B3.115, X, X01, X02 et X03) est issue de Bajjouk et al. (2015). Dans ces traductions, les noms d’espèces ont été mis à jour c’est-à-dire que le nom valide de l’espèce a été recherché dans les principaux référentiels taxonomiques (WoRMS, TaxRef et ERMS) et son synonyme est indiqué entre parenthèses. Pour les autres habitats, les traductions de Louvel et al. (2013) ont été reprises et actualisées suite aux modifications apportées à certains descriptifs dans la version 2012 d'EUNIS. Des traductions complémentaires ont également été effectuées par l'UMS PatriNat pour quelques habitats nouvellement considérés comme présents en France.

Enfin, des corrections mineures sont apportées au fur et à mesure de la détection d'erreurs, de légères différences peuvent donc apparaître avec les rapports initiaux. Remarque : entre les versions 2008 et 2012 d'EUNIS, la liste des habitats n'a pas été modifiée, seules de légères corrections ont été apportées à certains descriptifs. De ce fait, les correspondances avec d'autres typologies, établies en se référant à la version 2008 restent valables avec la version de 2012.

La version révisée d'EUNIS sera intégrée dans HABREF une fois que l'ensemble des chapitres aura été diffusé par le Centre thématique européen pour la Diversité biologique. En attendant, les chapitres publiés sont mis à disposition sur le site de l'INPN en format Excel.";"Base de données ""Eunishab_2008.mdb"" transmise par Doug Evans (ETC/BD) le 16/02/2009. Extraction de base de données ""EUNIS habitat classification 2012.xlsx"" transmise par Mette Palitzsch Lund (ETC/BD) le 10/03/2014. Les champs de traduction et de statut de présence en France ont été saisis par l'UMS PatriNat.";"Louvel J., Gaudillat V. & Poncet L., 2013. EUNIS, European Nature Information System, Système d’information européen sur la nature. Classification des habitats. Traduction française. Habitats terrestres et d’eau douce. MNHN-DIREV-SPN, MEDDE, Paris, 289 p.
Bajjouk T., Guillaumont B., Michez N., Thouin B., Croguennec C., Populus J., Louvel‐Glaser J., Gaudillat V., Chevalier C., Tourolle J., Hamon D. et al., 2015. Classification EUNIS, Système d’information européen sur la nature : Traduction française des habitats benthiques des Régions Atlantique et Méditerranée. Vol. 1. Habitats Littoraux. Réf. IFREMER/DYNECO/AG/15‐02/TB1, 231 p.
Bajjouk T., Guillaumont B., Michez N., Thouin B., Croguennec C., Populus J., Louvel‐Glaser J., Gaudillat V., Chevalier C., Tourolle J., Hamon D. et al., 2015. Classification EUNIS, Système d’information européen sur la nature : Traduction française des habitats benthiques des Régions Atlantique et Méditerranée. Vol. 2. Habitats subtidaux & complexes d’habitats. Réf. IFREMER/DYNECO/AG/15‐02/TB2, 337 p.
Legros B., Ichter J., Cellier P., Houard X., Louboutin B., Poncet L., Puissauve R. & Touroult J., 2016. Caractérisation des relations Espèce-Habitat naturel et gestion de l'information. Guide méthodologique. Version 1. Rapport SPN 2016-01. Service du patrimoine naturel, Muséum national d'Histoire naturelle, Paris, 43 p. + annexes.";Classification, habitats, EUNIS.;European Topic Centre on Biological Diversity, 2012. European Nature Information System (EUNIS) Database. Habitat types and Habitat classifications. ETC/BD-EEA, Paris. Traductions et statut de présence en France : PatriNat (OFB-CNRS-MNHN) et IFREMER / INPN, octobre 2022.;true;"HabRef v7 : le statut de plusieurs habitats passe de ""Absent"" à ""Présent"" en France (G4.8, G4.9, G4.B, G4.D, G4.E, G4.F) et leurs intitulés et descriptifs ont été traduits en français.";TYPO;;
104;TYPO_MICROHAB_ARB;Micro-habitats_de_l'arbre;Micro-habitats liés à l'arbre des forêts tempérées et méditerranéennes;05/07/2021;"Laurent Larrieu (INRA, UMR1201 DYNAFOR, France), Yoan Paillet (Irstea, UR EFNO, France), Susanne Winter (WWF World Wide Fund for Nature Germany, Germany), Rita Bütler (Swiss Federal Research Institute WSL, Switzerland), Daniel Kraus (Chair of Silviculture, University of Freiburg, Germany), Frank Krumm (Swiss Federal Research Institute WSL, Switzerland), Thibault Lachat (Swiss Federal Research Institute WSL, Switzerland ; Bern University of Applied Sciences, School of Agricultural, Forest and Food Sciences HAFL,  Switzerland),  Alexa K. Michel (Thünen Institute of Forest Ecosystems, Germany), Baptiste Regnery (Muséum national d'Histoire naturelle, Service du Patrimoine Naturel, France, Observatoire Régional de l’Environnement Poitou-Charentes, France), Kris Vandekerkhove (Research Institute for Nature and Forest (INBO), Belgium)";Jessica Thévenot (UMS PatriNat (OFB -CNRS - MNHN));France métropolitaine;Larrieu et al. 2018;Français;Typologie des micro-habitats liés à l'arbre des forêts tempérées et méditerranéennes selon la publication de Larrieu et al. 2018. Cette table permettra de faire le lien avec des espèces présentent dans TAXREF, d'autres typologies d'habitats et des programmes comme FRISBEE.;"La table comprend les différents micro-habitats cités dans la publication de Larrieu 2018 avec un système hiérarchique divisés en 3 niveaux (1 = Forme, 2 = Groupe et 3 = type). Des définitions y sont associées ainsi que des tailles seuils. Des codes sont créés dans cette table (LB_CODE) pour chaque niveau de micro-habitats afin d'identifier les niveaux parents et pour créer le système hiérarchique. Le champ ""Seuil"" a été ajouté à HABREF pour cette typologie. Chaque micro-habitat est représenté en ligne. Certains intitulés de micro-habitats ont le même nom mais avec une hiérarchie différente et se calque sur la publication de Larrieu 2018.";"Le document source est une référence bibliographique en open access au format PDF. La publication (tableau et définitions) a été transcrite en français et mise sous forme de tableau au sein d'une fichier Excel  ""Larrieu 2018"". La typologie ""TYPO_MICROHAB_ARB"" a été créée à partir du fichier Excel.";Larrieu, Laurent & Paillet, Yoan & Winter, Susanne & Bütler, Rita & Kraus, Daniel & Krumm, Frank & Lachat, Thibault & Michel, Alexa & Regnery, Baptiste & Vandekerkhove, Kris. 2018. Tree related microhabitats in temperate and Mediterranean European forests: A hierarchical typology for inventory standardization. Ecological Indicators. 84. 194-207. 10.1016/j.ecolind.2017.08.051.;Micro-habitats, arbres, forêts tempérées, forêt méditerranéennes;Larrieu, Laurent & Paillet, Yoan & Winter, Susanne & Bütler, Rita & Kraus, Daniel & Krumm, Frank & Lachat, Thibault & Michel, Alexa & Regnery, Baptiste & Vandekerkhove, Kris. 2018. Tree related microhabitats in temperate and Mediterranean European forests: A hierarchical typology for inventory standardization. Ecological Indicators. Mise en table : UMS PatriNat (OFB - CNRS - MNHN) / INPN, juin 2021.;true;;TYPO;;
8;TYPO_HIC;Habitats_d'intérêt_communautaire_(HIC);"Liste hiérarchisée et descriptifs des Habitats d'Intérêt Communautaire (HIC) de la directive ""Habitats-Faune-Flore""";24/04/2014;Commission européenne;PatriNat;Union européenne (28 États membres);European Topic Centre on Biological Diversity (ETC/BD) pour la Commission européenne;UK, FR;"La directive 92/43/CEE du Conseil du 21 mai 1992 concernant la conservation des habitats naturels ainsi que de la faune et de la flore sauvages, dite directive ""Habitats"", modifiée, liste dans son annexe I les types d'habitats naturels d'intérêt communautaire. Ceux-ci sont regroupés par grands types de milieux selon 9 grandes familles (1 - Habitats côtiers et végétations halophytiques, 2 - Dunes maritimes et intérieures, 3 - Habitats d'eaux douces, 4 - Landes et fourrés tempérés, 5 - Fourrés sclérophylles (matorrals), 6 - Formations herbeuses naturelles et semi-naturelles, 7 - Tourbières hautes, tourbières basses et bas-marais, 8 - Habitats rocheux et grottes, 9 - Forêts), elles-mêmes subdivisées en un niveau inférieur. Sur 233 habitats d'intérêt communautaire, 133 sont présents en France.";"Mise en table de la liste des habitats d'intérêt communautaire de l'annexe I de la directive ""Habitats"" et des informations descriptives données par le manuel d'interprétation des habitats de l'Union européenne (version EUR 28). Ces données ont été complétées par le statut de présence en France selon les arrêtés officiels publiés au JORF. Pour les habitats marins présents en France (UE 1110 à 1180 et UE 8330), des corrections mineures (essentiellement orthographiques ou typographiques) ont pu être apportées aux intitulés français, et ponctuellement aux intitulés anglais, des habitats. Dans l'annexe I de la directive ""Habitats"" et le manuel d'interprétation, il n'existe pas de niveau intermédiaire entre le grand type de milieux 4 ""Landes et fourrés tempérés"" et les habitats d'intérêt communautaire qu'il comporte (4010, 4020, etc.). Par homogénéité avec le reste de la table, un code 40 a été créé avec le même intitulé que le code 4. Par ailleurs, il n'existe pas d'habitat codé 6290, d'où un passage direct de 6280 à 62A0. NB : pour les habitats marins présents en France, les espèces mentionnées dans le manuel d'interprétation (version EUR 28) ont été reprises dans l'onglet ""Espèces"". Lorsque des précisions géographiques étaient données, seules les espèces signalées pour les zones Atlantique et Méditerranée ont été prises en compte.

Pour les habitats marins présents en France (UE 1110 à 1180 et UE 8330), une interprétation nationale détaillée est fournie accompagnée de précisions (superpositions possibles avec d'autres habitats, délimitation géographique, etc.).

NB : pour mémoire, on peut mentionner que, dans la version EUR 15 (1996-1997) du manuel d'interprétation, figurent des sous-types d'habitats d'intérêt communautaire dotés d'un code Natura 2000 (ex. 2191 Mares dunaires) dont l'usage a été abandonné depuis. On peut noter qu'il existe des différences entre les codes retenus dans la version EUR 15 du manuel d'interprétation et dans le logiciel Natura 2000 (table ""hbhdax""). Codes cités dans hbhdax mais pas dans EUR 15 : 2134, 6174, 6175, 6211 à 6215. Code cité dans EUR 15 mais pas dans la table ""hbhdax"" : 5216.";"- Directive 2013/17/EU : fichiers ""CELEX_32013L0017_EN_TXT.pdf"" (version en anglais) et ""CELEX_32013L0017_FR_TXT.pdf"" (version en français), disponibles sur le site EUR-Lex (http://eur-lex.europa.eu/legal-content/FR/TXT/?uri=uriserv%3AOJ.L_.2013.158.01.0193.01.ENG), consultés le 24/04/2014. - Manuel d'interprétation des habitats de l'Union européenne, version EUR 28 : fichier ""Int_Manual_EU28.pdf"" disponible sur le site de la Commission européenne (http://ec.europa.eu/environment/nature/legislation/habitatsdirective/docs/Int_Manual_EU28.pdf), consulté le 24/04/2014. - Manuel d'interprétation des habitats de l'Union européenne, version EUR 15/2 : fichier ""cahier d'habitat tome 2version finale (11).doc"". - Manuel d'interprétation des habitats de l'Union européenne, version EUR 15 : version française en format papier ; version anglaise disponible sur le site Archive of European Integration (University of Pittsburgh), http://aei.pitt.edu/39330/, consulté le 30/04/2014. - Logiciel Natura 2000 (fichiers Access) : version 1.4 (janvier 1999), base de données ""CODINGS"", table ""hbhdax"". - Arrêté du 16 novembre 2001 (JORF du 7 février 2002), modifié par les arrêtés du 13 juillet 2005 (JORF du 23 septembre 2005), du 19 avril 2007 (JORF du 6 mai 2007), du 24 octobre 2008 (JORF du 31 octobre 2008) et du 8 août 2016 (JORF du 17 août 2016).";"Conseil de l'Union européenne. Directive 2013/17/UE du Conseil du 13 mai 2013 portant adaptation de certaines directives dans le domaine de l'environnement, du fait de l'adhésion de la République de Croatie. Annexes. Partie B Protection de la nature. Journal officiel de l'Union européenne, L 158 du 10/06/2013, p. : 195-203.

Council of the European Union. Council Directive 2013/17/EU of 13 May 2013 adapting certain directives in the field of environment, by reason of the accession of the Republic of Croatia. Annex. Part B Nature Protection. Official Journal of the European Union, L 158, of the 10/06/2013, p. : 195-203.

Commission européenne, 1999. Manuel d'interprétation des habitats de l'Union européenne. EUR 15/2, octobre 1999. Commission européenne, DG Environnement, Bruxelles, 132 p.

European Commission, 2013. Interpretation manual of European Union habitats. EUR 28. European Commission, DG Environment, 144 p.
Romão C., 1996. Interpretation manual of European Union habitats. Version EUR 15. European Commission, DG XI, Bruxelles, 103 p.

Romão C., 1997. Manuel d'interprétation des habitats de l'Union européenne. Version EUR 15. Commission européenne, DG XI, Bruxelles, 109 p.

Ministère de l'Aménagement du territoire et de l'Environnement. Arrêté du 16 novembre 2001 relatif à la liste des types d'habitats naturels et des espèces de faune et de flore sauvages qui peuvent justifier la désignation de zones spéciales de conservation au titre du réseau écologique européen Natura 2000. Journal officiel, n°32 du 7 février 2002. Modifié par les arrêtés du 13 juillet 2005 (JORF du 23 septembre 2005), du 19 avril 2007 (JORF du 6 mai 2007), du 24 octobre 2008 (JORF du 31 octobre 2008) et du 8 août 2016 (JORF du 17 août 2016).

de Bettignies T., La Rivière M., Delavenne J., Dupré S., Gaudillat V., Janson A.-L., Lepareur F., Michez N., Paquignon G., Schmitt A., de Roton G. & Toison V. (2021)  Interprétation française des Habitats d’Intérêt Communautaire marins. PatriNat (OFB-CNRS-MNHN), Paris, 58 pp.";"Directive ""Habitats"", habitats, intérêt communautaire, manuel d'interprétation, EUR 28, HIC, DHFF";"PatriNat, 2023. Table des Habitats d'Intérêt Communautaire (HIC) de la Directive ""Habitats-Faune-Flore"". Base de données HabRef  v7.";true;"Depuis la version 6 d'HABREF (décembre 2021) : Pour les habitats marins présents en France (UE 1110 à 1180 et UE 8330), suppression des champs descriptifs EUR15/2, ajout des champs ""interprétation française"", ""précisions de l'interprétation française"" et ""Appellation française alternative""

Depuis la version 4 et 5 d'HABREF (novembre 2019) : pas de modification.

Depuis la version 3.1 d’HABREF (janvier 2017) : mise à jour du statut de présence en France du 1180, passant de ""Absent"" à ""Présent"".

Depuis la version 2 d'HABREF (octobre 2015) : 
- mise à jour du statut de présence en France selon l'arrêté du 8 août 2016 ;
- compléments aux descriptifs de certains habitats pour lesquels les sous-types du manuel d'interprétation (EUR 28) manquaient.";TYPO;;
10;TYPO_CRSP_CH_UE;CH_HIC;"Correspondances entre les habitats des Cahiers d'habitats Natura 2000 et les habitats d'intérêt communautaire de la directive ""Habitats""";17/12/2009;Coordinateurs des Cahiers d'habitats : Céline Balmain (parc national des Écrins), Farid Bensettiti (Muséum national d'histoire naturelle / MNHN), Frédéric Bioret (université de Bretagne occidentale), Vincent Boullet (conservatoire botanique national de Mascarin), Camille Chavaudret-Laborie (Assemblée permanente des chambres d'agriculture / APCA), Hélène Chevallier (Fédération nationale des syndicats de propriétaires forestiers sylviculteurs), Janick Deniaud (APCA), Vincent Gaudillat (MNHN), Jacques Haury (École nationale supérieure agronomique - Institut national de la recherche agronomique, Rennes), Katia Herard-Logereau (MNHN), Jean-Philippe Lacoste (Conservatoire de l'espace littoral et des rivages lacutres), Jean-Claude Rameau (École nationale du génie rural, des eaux et des forêts, Nancy), Jean Roland (Réserves naturelles de France) et Jérémie Van Es (conservatoire botanique national alpin).;Vincent Gaudillat (Service du patrimoine naturel - Muséum national d'histoire naturelle / SPN-MNHN);France métropolitaine;Service du patrimoine naturel - Muséum national d'histoire naturelle;FR;"Les types d'habitats d'intérêt communautaire de la directive ""Habitats"" sont décrits dans le Manuel d'interprétation des habitats de l'Union européenne (dernière version : EUR 28, European Commission, 2013). Afin de compléter et préciser ce manuel pour la France, des Cahiers d'habitats ont été rédigés (Bensettiti et al., 2001-2005).";"Mise en table des correspondances entre les habitats déclinés, sous-génériques et génériques des Cahiers d'habitats et les habitats de la directive ""Habitats"" auxquels ils se rattachent, avec précision du type de relation.";Fichier créé par V. Gaudillat (SPN-MNHN).;"Bensettiti F., Rameau J.-C. & Chevallier H. (coord.), 2001. « Cahiers d’habitats » Natura 2000. Connaissance et gestion des habitats et des espèces d’intérêt communautaire. Tome 1 - Habitats forestiers. MATE/MAP/MNHN. Éd. La Documentation française, Paris, 2 volumes : 339 p. et 423 p. + cédérom.
Bensettiti F., Bioret F., Roland J. & Lacoste J.-P. (coord.), 2004. « Cahiers d’habitats » Natura 2000. Connaissance et gestion des habitats et des espèces d’intérêt communautaire. Tome 2 - Habitats côtiers. MEDD/MAAPAR/MNHN. Éd. La Documentation française, Paris, 399 p. + cédérom.
Bensettiti F., Gaudillat V. & Haury J. (coord.), 2002. « Cahiers d’habitats » Natura 2000. Connaissance et gestion des habitats et des espèces d’intérêt communautaire. Tome 3 - Habitats humides. MATE/MAP/MNHN. Éd. La Documentation française, Paris, 457 p. + cédérom.
Bensettiti F., Boullet V., Chavaudret-Laborie C. & Deniaud J. (coord.), 2005. « Cahiers d’habitats » Natura 2000. Connaissance et gestion des habitats et des espèces d’intérêt communautaire. Tome 4 - Habitats agropastoraux. MEDD/MAAPAR/MNHN. Éd. La Documentation française, Paris, 2 volumes : 445 p. et 487 p. + cédérom.
Bensettiti F., Herard-Logereau K., Van Es J. & Balmain C. (coord.), 2004. « Cahiers d’habitats » Natura 2000. Connaissance et gestion des habitats et des espèces d’intérêt communautaire. Tome 5 - Habitats rocheux. MEDD/MAAPAR/MNHN. Éd. La Documentation française, Paris, 381 p. + cédérom.
European Commission, 2013. Interpretation manual of European Union habitats. EUR 28. European Commission, DG Environment, 144 p.";Typologie, Cahiers d'habitats, Natura 2000, habitats, intérêt communautaire, habitats déclinés.;"Gaudillat V., 2016. Table de correspondances entre les habitats des Cahiers d'habitats et les habitats d'intérêt communautaire de la directive ""Habitats"". SPN-MNHN / INPN, octobre 2016.";true;;CRSP;4;8
