CD_TYPO;CD_TABLE;LB_NOM_TYPO;NOM_JEU_DONNEES;DATE_CREATION;AUTEUR_TYPO;AUTEUR_TABLE;TERRITOIRE;ORGANISME;LANGUE;PRESENTATION;DESCRIPTION;ORIGINE;REF_BIBLIO;MOTS_CLES;REFERENCEMENT;DIFFUSION;DERNIERE_MODIF;TYPE_TABLE;CD_TYPO_ENTRE;CD_TYPO_SORTIE
46;TYPO_ATL;NatHab-Atlantique;Typologie nationale des habitats marins benthiques de la Manche, de la Mer du Nord et de l'Atlantique (NatHab-Atl);21/12/2012;Noëmie Michez (UMS 2006 PATRINAT), Annabelle Aish (MNHN-SPN), Ann C. Andersen (ABICE/UMR 7144/ Sorbonne Université), Erwan Ar Gall (LEMAR/UMR 6539/IUEM), Alexandrine Baffreau (M2C/UMR 6143/Université de Caen Normandie), Touria Bajjouk (LEBCO/DYNECO/IFREMER), Hugues Blanchet (EPOC/UMR 5805/Université de Bordeaux), Pauline Cajeri (LIENSs/UMR 7266/Université de La Rochelle), Pauline Chauvet (LEP/EEP/IFREMER), Jean-Claude Dauvin (M2C/UMR 6143/Université de Caen Normandie), Dominique Davoult (EFEB/UMR 7144/ Sorbonne Université), Thibaut de Bettignies (UMS 2006 PATRINAT), Marie-Noëlle de Casamajor (LRHAQ/IFREMER), Sandrine Derrien-Courtel (Station de Biologie Marine de Concarneau/MNHN), Stanislas Dubois (LEBCO/DYNECO/IFREMER), Marie-Claire Fabri (LERPAC/LITTORAL/IFREMER), Aurélie Foveau (FBN/LELRA/IFREMER), Franck Gentil (DIVCO/UMR 7144/ Sorbonne Université), Brigitte Guillaumont (LEP/EEP/IFREMER), Jacques Grall (UMS 3113/IUEM/UBO), Christian Hily (LEMAR/CNRS/IUEM/UBO), Céline Houbin (Station Biologique de Roscoff/OSU), Anne-Laure Janson (UMS 2006 PATRINAT), Marie La Rivière (UMS 2006 PATRINAT), Laurent Lévèque (Station Biologique de Roscoff/OSU), Line Le Gall (ISYEB/UMR 7205/MNHN), Sophie Lozach (M2C/UMR 6143/Université de Caen Normandie), Lénaick Menot (LEP/EEP/IFREMER), Josiane Popovsky (IMA), Céline Rolet (LOG/UMR 8187/Université Lille 1), Thierry Ruellet (GEMEL), Pierre-Guy Sauriau (LIENSs/UMR 7266/Université de La Rochelle), Nathalie Simon (AD2M/UMR 7144/Sorbonne Université), Laurent Soulier (IMA), Eric Thiébaut (DIVCO/UMR 7144/ Sorbonne Université), Julie Tourolle (LEP/EEP/IFREMER), Inge Van den Beld (LEP/EEP/IFREMER);PatriNat;Manche, Mer du Nord et Atlantique français;PatriNat;FR;Compte tenu de l’intérêt grandissant des politiques publiques pour le milieu marin et de l’actualité chargée des différents programmes de gestion, de conservation ou d’inventaire (inventaires ZNIEFF, inventaire biologique et analyse écologique des habitats marins patrimoniaux des sites N2000 et des PNM, Directive Cadre Stratégie pour le Milieu Marin, Système d’Information sur la Nature et le Paysage), le besoin de cohérence est élevé. Le développement de ces programmes nécessite la mise en place et l’utilisation d’outils tels que les référentiels. Ils permettent de définir un langage commun ainsi que les unités de travail. Parmi ces référentiels, il existe plusieurs classifications des habitats benthiques. Créées dans des contextes particuliers, elles répondent à des objectifs donnés, soit de connaissance et d’inventaire comme la typologie des ZNIEFF-Mer (Dauvin et al., 1994), soit de gestion et de conservation comme la typologie des habitats d’intérêt communautaire de l’Union Européenne (European Commission, 2007). Ces outils, adaptés à leur problématique, se rapportent à des échelles différentes : européenne pour Natura 2000 et EUNIS, nationale ou régionale pour les ZNIEFF. Il était nécessaire d’homogénéiser et d’harmoniser ces référentiels existants. Pour cela un nouveau référentiel national des habitats marins benthiques a été créé en synthétisant cet existant et en le complétant. Il est composé de deux typologies : une relative aux biocénoses de Méditerranée et l’autre concernant les habitats de la Manche, de la Mer du Nord et de l’Atlantique. Son utilisation est préconisée pour l’ensemble des programmes ayant trait à la conservation des habitats marins à l’échelle nationale.;"Cette typologie sert de référence à l’échelle nationale pour les habitats marins benthiques présents en Manche, en Mer du Nord et en Atlantique.
Sa première version, parue en 2013 (rapport explicatif Michez et al., 2013), était intégralement basée sur la proposition de typologie du REBENT (Guillaumont et al., 2008 et Bajjouk et al., 2011) à laquelle des habitats identifiés dans la bibliographie ou émanant de la communauté scientifique avaient été intégrés ainsi que certains habitats de la classification EUNIS (2008). Elle contenait 458 unités réparties en 7 niveaux. Suite à l’acquisition de nouvelles informations sur les habitats marins benthiques, une mise à jour de la typologie était nécessaire pour qu’elle soit le reflet des connaissances actuelles et a abouti à une deuxième version parue en 2015 (rapport explicatif Michez et al., 2015). Elle incluait 565 unités réparties en 6 niveaux. La version actuelle, la version 3, est parue en 2019 (rapport explicatif Michez et al., 2019). Elle comporte 664 unités hiérarchisées selon 5 niveaux. Par rapport à la version 2, le premier niveau hiérarchique a entièrement été modifié par soucis de cohérence avec la mise à jour d’EUNIS. Il se compose de 28 unités qui sont des combinaisons d’un étage et d’un type de substrat (par exemple les roches infralittorales). De nouveaux habitats ont été ajoutés, la codification a été totalement revisitée et la terminologie a été homogénéisée.
La collaboration de nombreux experts benthologues a été primordiale pour l'établissement et la consolidation de ce référentiel.";Fichier créé par Noëmie Michez et mis à jour par Marie La Rivière, Juliette Delavenne et Salomé Andres (PatriNat);"Michez N., Aish A., Hily C., Sauriau P.-G., Derrien-Courtel S., de Casamajor M.-N., Foveau A., Ruellet T., Lozach S., Soulier L., Popovsky J., Blanchet H., Cajeri P., Bajjouk T., Guillaumont B., Grall J., Gentil F., Houbin C., Thiébaut E., 2013. Typologie des habitats marins benthiques français de Manche, de Mer du Nord et d'Atlantique Version 1. Rapport SPN 2013 - 9, MNHN, Paris, 32 p.

Michez N., Bajjouk T., Aish A., Andersen A. C., Ar Gall E., Baffreau A., Blanchet H., Chauvet P., Dauvin J.-C., De Casamajor M.-N., Derrien-Courtel S., Dubois S., Fabri M.-C., Houbin C., Le Gall L., Menot L., Rolet C., Sauriau P.-G., Thiebaut E., Tourolle J., Van den Beld I., 2015. Typologie des habitats marins benthiques de la Manche, de la Mer du Nord et de l’Atlantique Version 2. Rapport SPN 2015 - 45, MNHN, Paris, 61 p.

Michez N., Thiébaut E., Dubois S., Le Gall L., Dauvin J.C., Andersen A. C., Baffreau A., Bajjouk T., Blanchet H., de Bettignies T., de Casamajor M.-N., Derrien-Courtel S., Houbin C., Janson A.L., La Rivière M., Lévèque L., Menot L., Sauriau P.G., Simon N., Viard F., 2019. Typologie des habitats marins benthiques de la Manche, de la Mer du Nord et de l’Atlantique. Version 3. UMS PatriNat, Muséum national d'Histoire naturelle, Paris, 52 p.

La Rivière M., Delavenne J., Janson A.-L., Andres S., de Bettignies T., Blanchet H., Decaris F.-X., Derrien R., Derrien-Courtel S., Grall J., Houbin C., Latry L., Le Gal A., Lutrand A., Menot L., Percevault L., Tauran A., Thiébaut E., 2022. Fiches descriptives des habitats marins benthiques de la Manche, de la Mer du Nord et de l'Atlantique. PatriNat (OFB-CNRS-MNHN),Paris.

Bajjouk T., Derrien S., Gentil, F., Hily C., Grall J., 2011. Typologie d’habitats marins benthiques : analyse de l’existant et propositions pour la cartographie. Habitats côtiers de la région Bretagne - Note de synthèse n° 2 - Habitats du circalittoral. Projets REBENT-Bretagne et Natura 2000-Bretagne. RST/IFREMER/DYNECO/AG/11-03/TB. 24 p. + Annexes.

Bajjouk T., Menot L., Van den Beld I., Tourolle J., Fabri M.C., Chauvet P., 2015. Contributions au Référentiel National des Habitats Benthiques de la Région Atlantique : Identification et Classification des Habitats Profonds ‐ Fiches Descriptives. Rapport d’activités 2014, Réf. RST/IFREMER/DYNECO/AG/15‐03/TB, 41 p.

Commission OSPAR, 2008. Descriptions des habitats inscrits sur la liste OSPAR des espèces et des habitats menacés et/ou en déclin. Commission OSPAR, numéro de référence 2008-07, 10 p.

Dauvin J.C., Bellan G., Bellan-Santini D., Castric A., Comolet-Tirman J., Francour F., Gentil F., Girard A.,Gofas S., Mahé C., Noël P. et de Reviers B., 1994. Typologie des ZNIEFF-Mer, liste des paramètres et des biocénoses des côtes françaises métropolitaines. Coll. Patrimoines Naturels, vol. 12. 2e éd., Secrétariat Faune-Flore/MNHN, Paris, 70 p.

European Topic Centre on Biological Diversity, 2012. European Nature Information System (EUNIS) Database. Habitat types and Habitat classifications. ETC/BD-EEA, Paris. Traductions et statut de présence en France : SPN-MNHN et IFREMER / INPN, octobre 2016.

Evans D., Aish A., Boon A., Condé S., Connor D., Gelabert E. Michez N., Parry M., Richard D., Salvati E., Tunesi L., 2016. Revising the marine section of the EUNIS Habitat classification - Report of a workshop held at the European Topic Centre on Biological Diversity, 12 & 13 May 2016. ETC/BD report to the EEA, 8 p.

Guillaumont B., Bajjouk T., Rollet C., Hily C., Gentil, F., 2008. Typologie d’habitats marins benthiques : analyse de l’existant et propositions pour la cartographie - Habitats côtiers de la région Bretagne - Note de synthèse. Projets REBENT-Bretagne et Natura-Bretagne. RST/IFREMER/DYNECO/AG/08-06/REBENT. 16p + Annexes.";typologie, habitat marin benthique, Manche, Mer du Nord, Atlantique, référentiel, France;PatriNat, 2023. Table de la typologie nationale des habitats marins benthiques de la Manche, de la Mer du Nord et de l'Atlantique (NatHab-Atl). Base de données HabRef  v7.;true;"Depuis la version 5.0 d'HABREF (novembre 2019), modifications de la version 3 de la typologie incluses dans la version 7.0 d'HABREF : 108 fiches descriptives complètes ont été ajoutées pour toutes les unités de niveau 2 et certains champs descriptifs ont été remplis pour 320 fiches de niveau 3 ou 4. Le libellé de 10 unités a été modifié (5 pour tenir compte de l'évolution de la taxonomie et 5 pour clarifier le cadre de l'unité). Une unité de niveau 3 a été supprimée et les 2 unités de niveau 4 qu'elle incluait ont été déplacées. Le statut de présence en France de 22 unités a été modifié en incertain (à confirmer).

Version 3 de la typologie incluse dans la version 5.0 d’HABREF, pour plus d’explications sur les modifications opérées dans cette version de la typologie se reporter au rapport : Michez N., Thiébaut E., Dubois S., Le Gall L., Dauvin J.C., Andersen A. C., Baffreau A., Bajjouk T., Blanchet H., de Bettignies T., de Casamajor M.-N., Derrien-Courtel S., Houbin C., Janson A.L., La Rivière M., Lévèque L., Menot L., Sauriau P.G., Simon N., Viard F., 2019. Typologie des habitats marins benthiques de la Manche, de la Mer du Nord et de l’Atlantique. Version 3. UMS PatriNat, Muséum national d'Histoire naturelle, Paris, 52 p.";TYPO;;
48;TYPO_CRSP_EUNIS_BARCELONE;EUNIS_BARCELONE;Correspondances entre la classification des habitats EUNIS (2008) et la typologie des biocénoses benthiques méditerranéennes de la Convention de Barcelone;01/04/2014;"Pour la typologie des biocénoses benthiques méditerranéennes de la Convention de Barcelone : PNUE, PAM, CAR/ASP, Pergent G., Bellan-Santini D., Bellan G., Bitar G., Harmelin J.G.

Pour la classification des habitats EUNIS : European Topic Centre on Biological Diversity (ETC/BD).";Noëmie MICHEZ  (Service du patrimoine naturel - Muséum national d'histoire naturelle);Méditerranée française;SPN-MNHN;FR et EN;Mise en correspondance de la typologie des biocénoses benthiques méditerranéennes de la Convention de Barcelone avec la classification des habitats EUNIS (2008). La relation de correspondance entre les deux habitats est précisée. Un rapport est associé à ce travail : Michez N., Aish A., Dirberg G., 2012. Typologie des habitats marins, Correspondances. Rapport SPN 2012 - 39, MNHN, Paris, 95 pages. S'y reporter pour prendre connaissance du contexte, de la démarche et de leurs applications et limites.;Mise en table et dans le sens inverse des correspondances entre la typologie des biocénoses benthiques méditerranéennes de la Convention de Barcelone et la classification des habitats EUNIS (2008).;Fichier créé par Noëmie MICHEZ (SPN-MNHN).;"European Topic Centre on Biological Diversity, 2008. European Nature Information System (EUNIS) Database. Habitat types and Habitat classifications. ETC/BD-EEA, Paris.
PNUE, PAM, CAR/ASP, 2006. Classification des biocénoses benthiques marines de la région Méditerranéenne. CAR/ASP, Tunis, 13 p.
PNUE, PAM, CAR/ASP, 2007. Manuel d’interprétation des types d'habitats marins pour la sélection des sites à inclure dans les inventaires nationaux de sites naturels d’intérêt pour la Conservation. Pergent G., Bellan-Santini D., Bellan G., Bitar G. et Harmelin J.G. eds., CAR/ASP publ., Tunis, 199 p.";correspondances, biocénose benthique, habitat marin, typologie, EUNIS, Méditerranée, France, convention, Barcelone;Michez N., 2012. Correspondances entre la classification des habitats EUNIS (2008) et la typologie des biocénoses benthiques méditerranéennes de la Convention de Barcelone. SPN-MNHN / INPN, novembre 2012.;true;;CRSP;7;6
35;TYPO_PAL_SPM;Habitats_de_Saint-Pierre-et-Miquelon;Typologie des habitats de Saint-Pierre-et-Miquelon;09/12/2010;Pour les habitats spécifiques à Saint-Pierre-et-Miquelon : Serge Muller (université de Metz puis Muséum national d'Histoire naturelle), Roger Etcheberry et Frank Urtizbéréa (DTAM de Saint-Pierre-et-Miquelon). Pour les habitats issus de la classification des habitats du Paléarctique : Pierre Devillers, Jean Devillers-Terschuren et Charles Vander Linden (Institut Royal des Sciences Naturelles, Bruxelles);Vincent Gaudillat (UMS PatriNat), avec la participation de Serge Muller pour le positionnement des unités au sein de la classification des habitats du Paléarctique.;Saint-Pierre-et-Miquelon (SPM);UMS PatriNat (OFB-CNRS-MNHN);FR;Suite à des études de terrain, Muller et Etcheberry ont proposé en 2006 une esquisse de typologie des habitats de Saint-Pierre-et-Miquelon. 36 habitats élémentaires y sont répertoriés et classés dans 10 grandes classes de végétations (habitats rocheux, landes, forêts...) selon une codification spécifique. 3 habitats élémentaires ont fait l'objet par la suite d'une publication spécifique par Muller en 2008.;"Intégration des habitats élémentaires de la typologie de Muller et Etcheberry au sein de la classification des habitats du Paléarctique afin de disposer d'un référentiel des habitats terrestres de Saint-Pierre-et-Miquelon. Même si le domaine paléarctique ne s'étend pas jusqu'à l'Amérique du Nord, il a été considéré que les habitats présents sur Saint-Pierre-et-Miquelon avaient suffisamment d'analogies avec les types d'habitats du domaine paléarctique pour pouvoir être intégrés dans cette classification. Les intitulés et les descriptifs des unités de cette classification font souvent référence à des territoires géographiques. Lorsqu'il s'agissait du domaine paléarctique dans son entier, du domaine nord-atlantique, des côtes de l'Atlantique..., il a été considéré que les habitats de Saint-Pierre-et-Miquelon pouvaient s'intégrer dans ces unités. Néanmoins, compte tenu de leur spécificité, tous les habitats élémentaires de la typologie de Saint-Pierre-et-Miquelon se sont vus attribuer un code nouveau et spécifique faisant suite au dernier code de la classification paléarctique (selon la base PHYSIS 2001) au niveau considéré. Dans quelques cas, dans un souci de cohérence d'ensemble de la classification hiérarchique, de nouveaux codes de niveau supérieur ont également pu être créés (ex. : création d'un code 31.A1 pour l'habitat élémentaire de ""Fourré arbustif à Alnus crispa et Amelanchier bartramiana"" et d'un code de niveau supérieur 31.A pour les ""Fourrés arbustifs des zones boréo-atlantiques de l'Amérique du Nord""). Hormis ce cas de figure, les niveaux supérieurs aux habitats élémentaires de Saint-Pierre-et-Miquelon ont été repris de la classification paléarctique et traduits.

Ce travail fait suite à une premier travail d'intégration des habitats de Saint-Pierre-et-Miquelon dans Corine Biotopes réalisé dans le cadre du programme Znieff (que l'on peut nommer typologie SPM Znieff). Les habitats sont cette fois intégrés dans la classification paléarctique qui s'avère plus adéquate compte tenu de son extension géographique bien plus vaste et d'une codification plus détaillée. À cette occasion, les habitats élémentaires de Saint-Pierre-et-Miquelon ont pu être changés de place par rapport à ce premier travail. Il est à noter que cette typologie de Saint-Pierre-et-Miquelon Znieff comporte quelques unités qui ne figuraient pas dans la typologie de Muller et Etcheberry (Falaises rocheuses nues par ex.), ces unités ont été conservées dans le présent travail. Les codifications originelles de Muller et Etcherry et de la typologie de Saint-Pierre-et-Miquelon Znieff ont également été conservées. NB : il est probable que les habitats recensés à Saint-Pierre-et-Miquelon ne sont pas spécifiques à l'archipel et peuvent être rencontrés à Terre-Neuve. De ce fait, les intitulés et descriptifs de ces habitats ne mentionnent pas directement l'archipel mais font référence aux ""zones boréo-atlantiques de l'Amérique du Nord"".

Les références bibliographiques des habitats issus de la classification paléarctique ont fait l'objet de quelques corrections mineures : par exemple, correction de certaines lettres accentuées qui n'apparaissaient pas correctement (ex. : ""Bourn,rias"" a été corrigé en ""Bournérias"").";"Table ""TYPOLOGIE"" de la base Saint Pierre-et-Miquelon v. 1.0 de l'application Znieff SPM, transmise par A. Horellou (SPN-MNHN) le 07/07/2009 en format Excel. Table ""TYPO_PAL_PHYSIS_2001"" exportée depuis le serveur Oracle du SPN en format Excel (version du 16/04/2010).";- Muller S. & Etcheberry R., 2006. Annexe 3. Esquisse de typologie des habitats naturels de flore de l’archipel de Saint-Pierre-et-Miquelon. In Muller S., Conservation de la biodiversité à Saint-Pierre et Miquelon. Rapport de mission dans l’archipel du 15 au 29 juillet 2006. MEDD-Université P. Verlaine, Metz, 34 p. - Muller S., 2008. La lande basse à Diapensia lapponica de l'archipel de Saint-Pierre-et-Miquelon et sa signification biogéographique. Rev. Ecol. (Terre Vie), 63 : 391-396. - Devillers P., Devillers-Terschuren J. & Vander Linden C., 2001. PHYSIS Palaearctic Habitat Classification. Updated to 10 December 2001. Institut Royal des Sciences Naturelles, Bruxelles.;Typologie, habitats, Saint-Pierre-et-Miquelon, classification des habitats du Paléarctique;Muller S., Etcheberry R., Urtizbéréa F. & Gaudillat V., 2019. Typologie des habitats de Saint-Pierre-et-Miquelon. Université P. Verlaine, Metz, UMS PatriNat, Paris. Mise en table : UMS PatriNat / INPN, septembre 2019.;true;"HABREF v5 : 7 habitats ont été ajoutés à la typologie suite à des propositions des auteurs de la typologie formulées dans le cadre de l'établissement des listes d'habitats susceptibles de faire l'objet d'un arrêté de protection d'habitat naturel (APHN). A cette occasion, quelques intitulés en français d'habitats ont été modifiés afin de les rendre plus cohérents avec la situation biogéographique de Saint-Pierre-et-Miquelon. Dans leurs intitulés en anglais issus de la classification Paléarctique, les termes modifiés ont été mis entre crochets. 2 habitats strictement marins ont été supprimés (11.1 et 11.2), ces habitats étant traités dans une typologie spécifique consacrée aux habitats marins de Saint-Pierre-et-Miquelon. Les unités incluses dans ""24 - Eaux courantes"" ont été modifiées (révision du découpage et ajout de ""24.81 - Sources"").

HABREF v6 : mise en table des relations habitats-espèces caractéristiques.";TYPO;;
