CD_HAB_FIELD;CD_TYPO;LB_HAB_FIELD;FORMAT_HAB_FIELD;DESCRIPT_HAB_FIELD;ORDRE_HAB_FIELD;LENGTH_HAB_FIELD;LB_LABEL;DATE_CREA;DATE_MODIF
80;22;NIVEAU;NUMBER;Niveau du code CORINE Biotopes correspondant à son nombre de chiffres/lettres, de 1 à 8 (le . marquant la décimale n'est pas pris en compte).;9;22;Niveau;2014-06-19 11:12:45;2023-04-04 12:35:11
81;22;LB_NIVEAU;VARCHAR2;Intitulé du niveau.;10;255;Intitulé du niveau;2014-06-19 11:12:45;2023-04-04 12:35:11
82;22;FRANCE;VARCHAR2;Présence de l'habitat en France.;13;5;Présence en France;2014-06-19 11:12:45;2023-04-04 12:35:11
83;22;LB_HAB_FR;VARCHAR2;Intitulé de l'habitat selon la version en français de 1997 ou traduction nouvelle dans le cas de codes non retenus dans cette version mais présents en France.;5;255;Nom en français (1997);2014-06-19 11:12:45;2023-04-04 12:35:11
84;22;LB_HAB_EN;VARCHAR2;Intitulé de l'habitat en anglais selon la version de 1991.;7;255;Nom en anglais (1991);2014-06-19 11:12:45;2023-04-04 12:35:11
85;22;CRSP_PHYTO_CB91;VARCHAR2;"Correspondances phytosociologiques de l&#39;habitat selon la version de 1991.";21;4000;Correspondances phytosociologiques;2014-06-19 00:00:00;2023-04-04 12:35:11
86;22;LB_DESCRIPTION;VARCHAR2;"Descriptif de l&#39;habitat en anglais selon la version de 1991.";14;4000;Descriptif officiel;2014-06-19 00:00:00;2023-04-04 12:35:11
441;45;FG_VALIDITE;VARCHAR2;Validité du nom de l'habitat (nom de référence / synonyme).;2;20;Validité;2014-06-19 13:23:53;2023-04-04 12:35:11
363;26;FG_VALIDITE;VARCHAR2;Validité du nom de l'habitat (nom de référence / synonyme).;2;20;Validité;2014-06-19 13:23:53;2023-04-04 12:35:11
535;78;CD_HAB;NUMBER;"Identifiant unique de l&#39;habitat. Non supprimable, et non réutilisable.";1;8;Identifiant HabRef de l'unité;2016-08-24 00:00:00;2023-04-04 12:35:11
536;78;FG_VALIDITE;VARCHAR2;"Validité du nom de l&#39;habitat (nom de référence / synonyme).";2;20;Validité;2016-08-24 00:00:00;2023-04-04 12:35:11
111;26;LB_CODE;VARCHAR2;Code habitat à 3 lettre et à 1 ou 2 chiffres.;4;20;Code;2014-06-19 00:00:00;2023-04-04 12:35:11
112;26;CD_HAB_SUP;VARCHAR2;Code de l'habitat parent (supérieur);11;20;Identifiant HabRef du parent;2014-06-19 00:00:00;2023-04-04 12:35:11
113;26;NIVEAU;VARCHAR2;Niveau hiérarchique de l'unité;9;10;Niveau;2014-06-19 00:00:00;2023-04-04 12:35:11
114;26;CD_HAB_ZNIEFF97;VARCHAR2;Code habitat dans Guillaume (1997);31;20;Code dans Guillaume (1997);2014-06-19 00:00:00;2023-04-04 12:35:11
115;26;NIVEAU_ZNIEFF97;VARCHAR2;"Niveau de l&#39;habitat dans Guillaume (1997)";32;20;Niveau dans Guillaume (1997);2014-06-19 00:00:00;2023-04-04 12:35:11
116;26;LB_NIVEAU;VARCHAR2;Intitulé du niveau.;10;20;Intitulé du niveau;2014-06-19 00:00:00;2023-04-04 12:35:11
117;26;FRANCE;BOOLEAN;Indication de la présence en France;13;10;Présence en France;2014-06-19 00:00:00;2023-04-04 12:35:11
118;26;LB_HAB_FR;VARCHAR2;Libellé de l'unité en français;5;100;Libellé;2014-06-19 00:00:00;2023-04-04 12:35:11
119;26;LB_HAB_EN;VARCHAR2;Libellé en anglais;7;20;Libellé en anglais;2014-06-19 00:00:00;2023-04-04 12:35:11
120;26;SALINITE;VARCHAR2;Niveau de salinité rencontré dans l'habitat;18;50;Salinité;2014-06-19 00:00:00;2023-04-04 12:35:11
121;26;EXPOSITION_AUX_VAGUES;VARCHAR2;Type d'exposition aux vagues pour lequel l'habitat est rencontré;21;50;Exposition aux vagues;2014-06-19 00:00:00;2023-04-04 12:35:11
122;26;COURANT_DE_MAREE;VARCHAR2;Type de courants de marée pour lequel l'habitat est rencontré;22;50;Type de courants de marée;2014-06-19 00:00:00;2023-04-04 12:35:11
123;26;SUBSTRAT;VARCHAR2;Substrat rencontré dans l'habitat;16;100;Substrat;2014-06-19 00:00:00;2023-04-04 12:35:11
124;26;GRANULOMETRIE;VARCHAR2;Granulométrie rencontrée dans l'habitat;17;200;Granulométrie;2014-06-19 00:00:00;2023-04-04 12:35:11
125;26;ETAGEMENT;VARCHAR2;Etage dans lequel se rencontre l'habitat;15;50;Etage;2014-06-19 00:00:00;2023-04-04 12:35:11
126;26;PROFONDEUR;VARCHAR2;Fourchette de profondeur à laquelle se rencontre l'habitat;20;50;Profondeur;2014-06-19 00:00:00;2023-04-04 12:35:11
127;26;TEMPERATURE;VARCHAR2;Fourchette de température pour laquelle l'habitat est rencontré;19;50;Température;2014-06-19 00:00:00;2023-04-04 12:35:11
537;78;CD_TYPO;NUMBER;Identifiant de la typologie.;3;8;Identifiant HabRef de la typologie;2016-08-24 00:00:00;2023-04-04 12:35:11
538;78;LB_CODE;VARCHAR2;"Code de l&#39;habitat.";4;50;Code de l'habitat;2016-08-24 00:00:00;2023-04-04 12:35:11
128;26;GEOMORPHOLOGIE_NON_RECIFALE;VARCHAR2;Type géomorphologique selon la typologie non récifale de Salomon 2008 (Salomon J.N., 2008. Géomorphologie sous-marine et littorale. Presses universitaires de Bordeaux);29;200;Géomorphologie de Salomon;2014-06-19 00:00:00;2023-04-04 12:35:11
129;26;GEOMORPHOLOGIE_RECIFALE;VARCHAR2;"Type géomorphologique selon la typologie récifale d&#39;Andréfouët 2008 (Andréfouët S., Chagnaud N., Chauvin C. & Kranenburg C.J., 2008. Atlas des récifs coralliens de France Outre-Mer. Centre IRD de Nouméa, 153 p.)";30;200;Géomorphologie d'Andréfouët;2014-06-19 00:00:00;2023-04-04 12:35:11
130;26;GEOMORPHOLOGIE_FINE;VARCHAR2;Type géomorphologique selon la typologie fine de Battistini 1975 (Battistini R. et al., 1975. Eléments de terminologie récifale indopacifique. Téthys, 7 (1) : 1-111, fig 1-77);28;200;Géomorphologie de Battistini;2014-06-19 00:00:00;2023-04-04 12:35:11
131;26;TROPHISME;VARCHAR2;Information trophique liées à l'habitat;23;20;Trophisme;2014-06-19 00:00:00;2023-04-04 12:35:11
132;26;LB_DESCRIPTION;VARCHAR2;Eléments descriptifs de l'habitat;14;50;Description;2014-06-19 11:12:45;2023-04-04 12:35:11
133;26;DISTRIBUTION_GEOGRAPHIQUE;VARCHAR2;Distribution géographique connue de l'habitat;24;50;Distribution géographique;2014-06-19 00:00:00;2023-04-04 12:35:11
134;26;FLORE_CHAR;VARCHAR2;Information sur la flore caractéristique de l'habitat;25;3000;Flore caractéristique;2014-06-19 00:00:00;2023-04-04 12:35:11
135;26;FAUNE_CHAR;VARCHAR2;Information sur la faune caractéristique de l'habitat;26;3000;Faune caractéristique;2014-06-19 00:00:00;2023-04-04 12:35:11
136;26;INFLUENCE_ANTHROPOGENIQUE;VARCHAR2;"Influences potielles des activités humaines sur l&#39;habitat";27;50;Influence anthropogénique;2014-06-19 00:00:00;2023-04-04 12:35:11
139;7;LB_CODE;VARCHAR2;Code EUNIS de l'unité;4;4;Code EUNIS;2014-06-19 00:00:00;2023-04-04 12:35:11
140;7;CD_HAB_SUP;VARCHAR2;"Code HabRef parent (niveau n+1) du code HabRef présent dans le champ ""CD_HAB"".";11;8;Identifiant HabRef du parent;2014-06-19 00:00:00;2023-04-04 12:35:11
141;7;NIVEAU;VARCHAR2;Niveau du code EUNIS correspondant à son nombre de chiffres/lettres, de 1 à 8 (le . marquant la décimale n'est pas pris en compte).;9;1;Niveau;2014-06-19 00:00:00;2023-04-04 12:35:11
142;7;LB_NIVEAU;VARCHAR2;Intitulé du niveau.;10;8;Intitulé du niveau;2014-06-19 00:00:00;2023-04-04 12:35:11
143;7;FRANCE;BOOLEAN;Présence en France de l'habitat. TRUE = présence, FALSE = absence, ? = présence en France à confirmer.;13;5;Présence en France;2014-06-19 00:00:00;2023-04-04 12:35:11
144;7;LB_HAB_FR;VARCHAR2;"Intitulé en français de l&#39;habitat EUNIS.";5;150;Nom en Français;2014-06-19 00:00:00;2023-04-04 12:35:11
146;7;LB_DESCRIPTION;VARCHAR2;"Descriptif en anglais de l&#39;habitat EUNIS dans sa version 2012.";14;4000;Descriptif officiel;2014-06-19 00:00:00;2023-04-04 12:35:11
147;7;LB_HAB_EN;VARCHAR2;"Intitulé en anglais de l'habitat EUNIS. Champ intitulé ""Scientific name"" dans la base EUNIS originelle.";7;255;Nom en anglais;2014-06-19 00:00:00;2023-04-04 12:35:11
150;7;NOTE;VARCHAR2;"Note additionnelle concernant la description ou la source de l'habitat EUNIS. Champ intitulé ""Owntext"" dans la base EUNIS originelle.";18;600;Remarques;2014-06-19 00:00:00;2023-04-04 12:35:11
160;5;LB_CODE;VARCHAR2;Code GMRC. Ce code est constitué d'une succession d'un à cinq numéros séparés par des point. Les premiers trois numéros correspondent aux grands types de complexes récifaux, les deux derniers représentent les unités géomorphologiques.;4;16;Code;2014-06-19 11:12:45;2023-04-04 12:35:11
161;5;CD_HAB_SUP;VARCHAR2;Code de l'habitat parent (supérieur);11;11;Identifiant HabRef du parent;2014-06-19 11:12:45;2023-04-04 12:35:11
162;5;NIVEAU;NUMBER;Niveau hiérarchique de l'unité;9;22;Niveau;2014-06-19 11:12:45;2023-04-04 12:35:11
163;5;LB_NIVEAU;VARCHAR2;Intitulé du niveau;10;45;Intitulé du niveau;2014-06-19 11:12:45;2023-04-04 12:35:11
164;5;FRANCE;VARCHAR2;Indication de la présence en France;13;1;Présence en France;2014-06-19 11:12:45;2023-04-04 12:35:11
167;5;CD_GMRC_FINAL;VARCHAR2;Code GMRC final, dit de niveau 5, procuré par la combinaison, unique, d’informations des niveaux 1 à 4. Ce code s'applique uniquement aux codes de niveau 4.;15;4;Code GMRC final;2014-06-19 11:12:45;2023-04-04 12:35:11
169;70;LB_CODE;VARCHAR2;Code de l'habitat : A puis 1 ou 2 chiffres, suivis au maximum de 6 décimales.;4;10;Code Antilles;2014-06-19 11:12:45;2023-04-04 12:35:11
170;70;CD_HAB_SUP;VARCHAR2;"Code HabRef de l'habitat parent (niveau n+1) du code HabRef présent dans le champ ""CD_HAB"".";11;9;Identifiant HabRef du parent;2014-06-19 11:12:45;2023-04-04 12:35:11
171;70;NIVEAU;VARCHAR2;Niveau de l'habitat correspondant à son nombre de chiffres / lettres, de 1 à 8 (le préfixe A et le . marquant la décimale ne sont pas pris en compte).;9;1;Niveau;2014-06-19 11:12:45;2023-04-04 12:35:11
174;70;LB_HAB_FR;VARCHAR2;Intitulé français de l'habitat.;5;200;Nom français;2014-06-19 11:12:45;2023-04-04 12:35:11
175;70;LB_HAB_EN;VARCHAR2;Intitulé anglais de l'habitat. Champ créé par souci d'homogénéité avec les autres bases de données habitats, mais non renseigné.;7;200;Nom anglais;2014-06-19 11:12:45;2023-04-04 12:35:11
177;71;LB_CODE;VARCHAR2;Code de l'habitat;4;10;Code Guyane;2014-06-19 11:12:45;2023-04-04 12:35:11
178;71;CD_HAB_SUP;VARCHAR2;"Code HabRef de l'habitat parent (niveau n+1) du code Habref présent dans le champ ""CD_HAB"".";11;9;Identifiant HabRef du parent;2014-06-19 11:12:45;2023-04-04 12:35:11
179;71;NIVEAU;VARCHAR2;Niveau de l'habitat correspondant à son nombre de chiffres / lettres, de 1 à 8 (le préfixe G et le . marquant la décimale ne sont pas pris en compte).;9;1;Niveau;2014-06-19 11:12:45;2023-04-04 12:35:11
180;71;LB_NIVEAU;VARCHAR2;Intitulé du niveau.;10;10;Intitulé du niveau;2014-06-19 11:12:45;2023-04-04 12:35:11
473;28;CD_HAB;NUMBER;Identifiant unique de l'habitat. Non supprimable, et non réutilisable.;1;22;Identifiant HabRef de l'unité;2014-06-19 13:23:53;2023-04-04 12:35:11
182;71;LB_HAB_FR;VARCHAR2;Intitulé français de l'habitat.;5;200;Nom français;2014-06-19 11:12:45;2023-04-04 12:35:11
183;71;LB_HAB_EN;VARCHAR2;Intitulé anglais de l'habitat. Champ créé par souci d'homogénéité avec les autres bases de données habitats, mais non renseigné.;7;200;Nom anglais;2014-06-19 11:12:45;2023-04-04 12:35:11
185;72;LB_CODE;VARCHAR2;Code de l'habitat;4;9;Code Réunion;2014-06-19 11:12:45;2023-04-04 12:35:12
186;72;CD_HAB_SUP;VARCHAR2;"Code HabRef de l'habitat parent (niveau n+1) du code HabRef présent dans le champ ""CD_HAB"".";11;8;Identifiant HabRef du parent;2014-06-19 11:12:45;2023-04-04 12:35:12
187;72;NIVEAU;VARCHAR2;Niveau de l'habitat.;9;1;Niveau;2014-06-19 11:12:45;2023-04-04 12:35:12
188;72;LB_NIVEAU;VARCHAR2;Intitulé du niveau.;10;8;Intitulé du niveau;2014-06-19 11:12:45;2023-04-04 12:35:12
370;7;FG_VALIDITE;VARCHAR2;Validité du nom de l'habitat (nom de référence / synonyme).;2;20;Validité;2014-06-19 13:23:53;2023-04-04 12:35:11
190;72;LB_HAB_FR;VARCHAR2;Intitulé français de l'habitat.;5;200;Nom français;2014-06-19 11:12:45;2023-04-04 12:35:12
191;72;LB_HAB_EN;VARCHAR2;Intitulé anglais de l'habitat. Champ créé par souci d'homogénéité avec les autres bases de données habitats, mais non renseigné.;7;200;Nom anglais;2014-06-19 11:12:45;2023-04-04 12:35:12
193;46;LB_CODE;VARCHAR2;Code de l'unité. Le niveau 1 est identifié par une lettre : M pour les habitats des substrats meubles, R pour les habitats des substrats rocheux et P pour les habitats particuliers. Les niveaux 2 à 7 sont identifiés par des chiffres séparés par des points.;4;18;Code;2014-06-19 11:12:45;2023-04-04 12:35:11
194;46;CD_HAB_SUP;VARCHAR2;Code de l'habitat parent (supérieur);11;15;Identifiant HabRef du parent;2014-06-19 11:12:45;2023-04-04 12:35:11
195;46;NIVEAU;VARCHAR2;Niveau hiérarchique de l'unité;9;1;Niveau;2014-06-19 11:12:45;2023-04-04 12:35:11
196;46;LB_NIVEAU;VARCHAR2;Intitulé du niveau.;10;8;Intitulé du niveau;2014-06-19 11:12:45;2023-04-04 12:35:11
197;46;LB_HAB_FR;VARCHAR2;Libellé de l'unité en français;5;180;Libellé;2014-06-19 11:12:45;2023-04-04 12:35:11
469;28;LB_DESCRIPTION;VARCHAR2;"Copie de la rubrique ""Synécologie"" de la fiche descriptive de l&#39;association comme publiée dans la synthèse de classe.";14;4000;Synécologie;2014-06-19 00:00:00;2023-04-04 12:35:11
200;46;FRANCE;VARCHAR2;Indication de la présence en France;13;5;Présence en France;2014-06-19 11:12:45;2023-04-04 12:35:11
202;8;CD_HAB_SUP;VARCHAR2;Identifiant HabRef de l'habitat parent.;11;4;Identifiant HabRef du parent;2014-06-19 11:12:45;2023-04-04 12:35:11
203;8;LB_HAB_EN;VARCHAR2;Intitulé en anglais de l'habitat.;7;5;Nom anglais;2014-06-19 11:12:45;2023-04-04 12:35:11
207;8;LB_HAB_DH_FR;VARCHAR2;"Intitulé en français de l'habitat selon l'annexe I de la directive ""Habitats"" (révisée par la directive 2013/17/UE), après éventuelle correction.";17;200;Nom français corrigé (DH);2014-06-19 00:00:00;2023-04-04 12:35:11
208;8;LB_HAB_DH_EN;VARCHAR2;"Intitulé en anglais de l'habitat selon l'annexe I de la directive ""Habitats"" (révisée par la directive 2013/17/UE), après éventuelle correction.";18;200;Nom anglais (DH);2014-06-19 00:00:00;2023-04-04 12:35:11
211;8;CRSP_PAL;VARCHAR2;Correspondances entre l'habitat (niveau 3) et la classification des habitats du Paléarctique (version 1995, sauf précision contraire) selon le manuel d'interprétation (version EUR 28).;24;150;Correspondances avec la classification du Paléarctique;2014-06-19 00:00:00;2023-04-04 12:35:11
539;78;LB_HAB_FR;VARCHAR2;"Intitulé français de l&#39;habitat.";5;500;Nom français;2016-08-24 00:00:00;2023-04-04 12:35:11
627;79;COND_STATIONNELLES;VARCHAR2;Description des conditions stationnelles (principalement les types de sols) dans lesquelles se développent les types forestiers.;17;;Conditions stationnelles;2016-11-14 00:00:00;2023-04-04 12:35:11
628;79;STRUC_PHYSIO_FORET;VARCHAR2;Informations sur la structure et la physionomie des types forestiers.;18;;Structure et physionomie forestière;2016-11-14 00:00:00;2023-04-04 12:35:11
629;79;COMP_TAXONOMIQUE;VARCHAR2;Informations sur la composition taxonomique (essences forestières, flore du sous-bois et grande faune).;19;;Composition taxonomique;2016-11-14 00:00:00;2023-04-04 12:35:11
630;79;ENJEUX_BIODIVERSITE;VARCHAR2;Evaluation des enjeux concernant la biodiversité (basée sur le calcul de la diversité alpha et bêta).;20;;Enjeux de biodiversité;2016-11-14 00:00:00;2023-04-04 12:35:11
1;6;LB_CODE;VARCHAR2;Code de l'unité. Le niveau 1 est identifié par un chiffre romain et les autres niveaux par un chiffre arabe séparés par des points.;4;255;Code;2014-06-19 00:00:00;2023-04-04 12:35:11
2;6;CD_HAB_SUP;VARCHAR2;Code de l'habitat parent (supérieur);11;255;Identifiant HabRef du parent;2014-06-19 00:00:00;2023-04-04 12:35:11
3;6;LB_NIVEAU;VARCHAR2;Niveau de l'habitat. Niveau 1 : Etage. Niveau 2 : Substrat. Niveau 3 : Biocénose. Niveau 4 : Association, Faciès, Enclave, Morpho-structure.;10;255;Intitulé du niveau;2014-06-19 00:00:00;2023-04-04 12:35:11
4;6;NIVEAU;NUMBER;Niveau hiérarchique de l'unité;9;22;Niveau;2014-06-19 00:00:00;2023-04-04 12:35:11
5;6;LB_HAB_FR;VARCHAR2;Libellé de l'unité en français;5;255;Libellé;2014-06-19 00:00:00;2023-04-04 12:35:11
7;6;LOC;VARCHAR2;Localisation de l'habitat;16;4000;Localisation;2014-06-19 00:00:00;2023-04-04 12:35:11
8;6;ETAGE;VARCHAR2;Le ou les étages dans le ou lesquels l'habitat peut se rencontrer;17;255;Etage;2014-06-19 00:00:00;2023-04-04 12:35:11
9;6;SUBSTRAT;VARCHAR2;Nature du substrat de l'habitat;18;255;Substrat;2014-06-19 00:00:00;2023-04-04 12:35:11
10;6;BATHY;VARCHAR2;Répartition bathymétrique de l'habitat;19;255;Répartition bathymétrique;2014-06-19 00:00:00;2023-04-04 12:35:11
11;6;SITUATION;VARCHAR2;Situation de l'habitat;20;255;Situation;2014-06-19 00:00:00;2023-04-04 12:35:11
12;6;HYDRO;VARCHAR2;Conditions hydrodynamiques dans lesquelles l'habitat peut se rencontrer;21;255;Hydrodynamisme;2014-06-19 00:00:00;2023-04-04 12:35:11
13;6;SALINITE;VARCHAR2;Salinité pour laquelle l'habitat peut se rencontrer;22;255;Salinité;2014-06-19 00:00:00;2023-04-04 12:35:11
14;6;TEMPERATURE;VARCHAR2;Température pour laquelle l'habitat peut se rencontrer;23;255;Température;2014-06-19 00:00:00;2023-04-04 12:35:11
15;6;LB_DESCRIPTION;VARCHAR2;Description de l'habitat;14;4000;Description;2014-06-19 00:00:00;2023-04-04 12:35:11
16;6;CRITERES;VARCHAR2;Principaux critères de reconnaissance de l'habitat;24;4000;Principaux critères de reconnaissance;2014-06-19 00:00:00;2023-04-04 12:35:11
17;6;ESPECES;VARCHAR2;Espèces caractéristiques/indicatrices de l'habitat;25;4000;Espèces caractéristiques/indicatrices;2014-06-19 00:00:00;2023-04-04 12:35:11
18;6;HAB_ASSOC;VARCHAR2;Habitats associés ou en contact;26;4000;Habitats associés ou en contact;2014-06-19 00:00:00;2023-04-04 12:35:11
19;6;CONFUSIONS;VARCHAR2;Confusions possibles avec d'autres habitats;27;4000;Confusions possibles;2014-06-19 00:00:00;2023-04-04 12:35:11
20;6;INTERET;VARCHAR2;Intérêt de l'habitat pour la conservation;28;4000;Intérêt pour la conservation;2014-06-19 00:00:00;2023-04-04 12:35:11
21;6;TENDANCES_MENACES;VARCHAR2;Tendances évolutives et les menaces potentielles de l'habitat;29;4000;Tendances et menaces;2014-06-19 00:00:00;2023-04-04 12:35:11
22;6;GESTION;VARCHAR2;Gestion et statut de conservation de l'habitat;30;4000;Gestion et statut de conservation;2014-06-19 00:00:00;2023-04-04 12:35:11
23;6;FACIES_ASSOCIATION;VARCHAR2;Faciès et associations de l'habitat;31;4000;Faciès et associations;2014-06-19 00:00:00;2023-04-04 12:35:11
24;6;FRANCE;VARCHAR2;Indication de la présence en France;13;255;Présence en France;2014-06-19 00:00:00;2023-04-04 12:35:11
25;6;REDACTEURS;VARCHAR2;Auteurs de la fiche de l'habitat;32;255;Auteurs de la fiche;2014-06-19 00:00:00;2023-04-04 12:35:11
27;32;LB_CODE;VARCHAR2;Code de l'unité. Le niveau 1 est identifié par un chiffre romain, les niveaux 2 et 3 par un chiffre arabe et le niveau 4 par une lettre minuscule. Ils sont séparés par des points.;4;20;Code;2014-06-19 00:00:00;2023-04-04 12:35:11
28;32;CD_HAB_SUP;VARCHAR2;Code de l'habitat parent (supérieur);11;20;Identifiant HabRef du parent;2014-06-19 00:00:00;2023-04-04 12:35:11
29;32;NIVEAU;NUMBER;Niveau hiérarchique de l'unité;9;22;Niveau;2014-06-19 00:00:00;2023-04-04 12:35:11
30;32;LB_NIVEAU;VARCHAR2;Niveau de l'habitat. Niveau 1 : Etage. Niveau 2 : Substrat. Niveau 3 : Biocénose. Niveau 4 : Association, Faciès, Enclave, Morpho-structure.;10;30;Intitulé du niveau;2014-06-19 00:00:00;2023-04-04 12:35:11
31;32;LB_HAB_FR;VARCHAR2;Libellé de l'unité en français;5;250;Libellé;2014-06-19 00:00:00;2023-04-04 12:35:11
32;32;FRANCE;VARCHAR2;Indication de la présence en France;13;10;Présence en France;2014-06-19 00:00:00;2023-04-04 12:35:11
35;3;LB_CODE;VARCHAR2;Code du syntaxon.;4;16;Code du syntaxon;2014-06-19 00:00:00;2023-04-04 12:35:11
36;3;CD_HAB_SUP;VARCHAR2;Identifiant HabRef du syntaxon parent.;11;16;Identifiant HabRef du parent;2014-06-19 00:00:00;2023-04-04 12:35:11
37;3;NIVEAU;NUMBER;Niveau du syntaxon dans la classification phytosociologique, codé de 1 à 8.;9;22;Niveau;2014-06-19 00:00:00;2023-04-04 12:35:11
38;3;LB_NIVEAU;VARCHAR2;Intitulé du niveau.;10;21;Intitulé du niveau;2014-06-19 00:00:00;2023-04-04 12:35:11
39;3;FRANCE;VARCHAR2;Présence du syntaxon en France.;13;5;Présence en France;2014-06-19 00:00:00;2023-04-04 12:35:11
40;3;LB_HAB_FR;VARCHAR2;Nom latin du syntaxon;5;255;Nom latin;2014-06-19 00:00:00;2023-04-04 12:35:11
44;3;LB_HAB_FR_COMPLET;VARCHAR2;Nom complet du syntaxon, résultant de la concaténation du nom latin et des auteurs.;6;255;Nom complet;2014-06-19 00:00:00;2023-04-04 12:35:11
45;3;LB_AUTEUR;VARCHAR2;Auteurs du syntaxon.;8;255;Auteurs;2014-06-19 00:00:00;2023-04-04 12:35:11
1073;8;INTERP_FR;VARCHAR2;"Définition de l’habitat selon l’interprétation française (détails et synthèse des critères d’identification de l&#39;habitat).";20;;Interprétation française;2022-03-10 00:00:00;2023-04-04 12:35:11
1074;8;PRECISIONS;VARCHAR2;"Précisions de l&#39;interprétation française (critères d’identification, détails des possibles superpositions entre HIC et critères de distinction avec d’autres HIC, références aux définitions des autres Etats Membres, spécificités
nationales).";21;;Précisions de l'interprétation française;2022-03-10 00:00:00;2023-04-04 12:35:11
1075;8;LB_HAB_FR_ALTER;VARCHAR2;Appellation française alternative de l’habitat (lorsque l’intitulé officiel français de l’habitat n’est pas assez explicite).;16;;Appellation française alternative;2022-03-10 00:00:00;2023-04-04 12:35:11
1076;108;CD_HAB;NUMBER;"Identifiant unique de l&#39;habitat. Non supprimable, et non réutilisable.";1;8;Identifiant HabRef de l'unité;2022-03-11 00:00:00;2023-04-04 12:35:11
1077;108;FG_VALIDITE;VARCHAR2;"Validité du nom de l&#39;habitat (nom de référence / synonyme)";2;20;Validité;2022-03-11 00:00:00;2023-04-04 12:35:11
46;3;LB_DESCRIPTION;VARCHAR2;Diagnose du syntaxon.;14;4000;Description;2014-06-19 00:00:00;2023-04-04 12:35:11
507;28;NOM_SYNTAXON;VARCHAR2;"Copie de la rubrique ""Association"" de la fiche descriptive de l&#39;association comme publiée dans la synthèse de classe.";16;1500;Nom cité du syntaxon;2015-09-15 00:00:00;2023-04-04 12:35:11
48;3;REMARQUES;VARCHAR2;Remarques sur le syntaxon.;17;4000;Remarques;2014-06-19 00:00:00;2023-04-04 12:35:11
50;4;CARACTERES_GENERAUX;VARCHAR2;Caractères généraux (uniquement pour les habitats génériques).;39;4000;Caractères généraux;2014-06-19 00:00:00;2023-04-04 12:35:12
51;4;HD;VARCHAR2;Déclinaison de l'habitat générique en habitats élémentaires.;40;4000;Déclinaison en habitats élémentaires;2014-06-19 00:00:00;2023-04-04 12:35:12
52;4;LB_CODE;VARCHAR2;Code de l'habitat.;4;18;Code de l'habitat;2014-06-19 00:00:00;2023-04-04 12:35:12
53;4;CD_HAB_SUP;VARCHAR2;Identifiant HabRef de l'habitat parent.;11;18;Identifiant HabRef du parent;2014-06-19 00:00:00;2023-04-04 12:35:12
54;4;NIVEAU;VARCHAR2;Niveau de l'habitat.;9;2;Niveau;2014-06-19 00:00:00;2023-04-04 12:35:12
55;4;LB_NIVEAU;VARCHAR2;Intitulé du niveau.;10;255;Intitulé du niveau;2014-06-19 00:00:00;2023-04-04 12:35:12
56;4;FRANCE;VARCHAR2;Présence en France de l'habitat.;13;5;Présence en France;2014-06-19 00:00:00;2023-04-04 12:35:12
57;4;LB_HAB_FR;VARCHAR2;Intitulé de l'habitat selon les Cahiers d'habitats.;5;255;Nom en français;2014-06-19 00:00:00;2023-04-04 12:35:12
508;28;SYNONYMES;VARCHAR2;"Copie de la rubrique ""Synonymes"" de la fiche descriptive de l&#39;association comme publiée dans la synthèse de classe.";17;;Synonymes;2015-09-15 00:00:00;2023-04-04 12:35:11
65;4;CARAC_DIAG_CARC_STAT;VARCHAR2;Caractères diagnostiques de l’habitat - Caractéristiques stationnelles.;21;4000;Caractéristiques stationnelles;2014-06-19 00:00:00;2023-04-04 12:35:12
66;4;CARAC_DIAG_VAR;VARCHAR2;Caractères diagnostiques de l’habitat - Variabilité.;22;4000;Variabilité;2014-06-19 00:00:00;2023-04-04 12:35:12
67;4;CARAC_DIAG_ESP;VARCHAR2;"Caractères diagnostiques de l’habitat - Espèces ""indicatrices"" du type d’habitat.";24;4000;"Espèces ""indicatrices""";2014-06-19 00:00:00;2023-04-04 12:35:12
68;4;CARAC_DIAG_CONF;VARCHAR2;Caractères diagnostiques de l’habitat - Confusions possibles avec d’autres habitats.;25;4000;Confusions possibles;2014-06-19 00:00:00;2023-04-04 12:35:12
69;4;CRSP;VARCHAR2;Correspondances biocénotiques ou phytosociologiques.;26;4000;Correspondances;2014-06-19 00:00:00;2023-04-04 12:35:12
70;4;DYNAMIQUE;VARCHAR2;Dynamique du peuplement ou de la végétation.;27;4000;Dynamique;2014-06-19 00:00:00;2023-04-04 12:35:12
71;4;HAB_ASSOC;VARCHAR2;Habitats associés ou en contact.;28;4000;Habitats associés ou en contact;2014-06-19 00:00:00;2023-04-04 12:35:12
72;4;REPARTITION_GEO;VARCHAR2;Répartition géographique.;29;4000;Répartition géographique;2014-06-19 00:00:00;2023-04-04 12:35:12
73;4;VALEUR;VARCHAR2;Valeur écologique et biologique.;30;4000;Valeur écologique et biologique;2014-06-19 00:00:00;2023-04-04 12:35:12
74;4;TENDANCES;VARCHAR2;Tendances évolutives et menaces potentielles.;32;4000;Tendances et menaces;2014-06-19 00:00:00;2023-04-04 12:35:12
75;4;POTENTIALITES;VARCHAR2;Potentialités intrinsèques de production.;33;4000;Potentialités intrinsèques de production;2014-06-19 00:00:00;2023-04-04 12:35:12
76;4;GESTION_RECOM;VARCHAR2;Cadre de gestion - Modes de gestion recommandés.;35;;Modes de gestion recommandés;2014-06-19 00:00:00;2023-04-04 12:35:12
77;4;RECHERCHE;VARCHAR2;Inventaires, expérimentations, axes de recherche à développer.;38;4000;Axes de recherche;2014-06-19 00:00:00;2023-04-04 12:35:12
78;22;LB_CODE;VARCHAR2;Code CORINE Biotopes, à 1 ou 2 chiffres suivis au maximum de 6 décimales.;4;9;Code CORINE Biotopes;2014-06-19 11:12:45;2023-04-04 12:35:11
79;22;CD_HAB_SUP;VARCHAR2;"Code HabRef parent (niveau n+1) du code HabRef présent dans le champ ""CD_HAB"".";11;8;Identifiant HabRef du parent;2014-06-19 11:12:45;2023-04-04 12:35:11
509;28;TYPE_NOMENCLATURAL;VARCHAR2;"Copie de la rubrique ""Type nomenclatural"" de la fiche descriptive de l&#39;association comme publiée dans la synthèse de classe.";18;;Type nomenclatural;2015-09-15 00:00:00;2023-04-04 12:35:11
